ID,Language_ID,Parameter_ID,Form,Segments,Comment,Source,form_in_source
1,adnyamathanha,1741,,a r a,,,
2,alyawarr,1741,,e r ɹ u l,,,
3,alyawarr,1741,,e r ɹ u l e ŋ,,,
5,arabana,1741,,a ɹ a t a,,,
8,yugambehbandjalang,1741,,w a j,,,
14,dhangu,1741,,g a r w a ɹ,,,
16,sydney,1741,,b u ɹ a w a,,,
18,dhuwal,1741,,g a r w a ɹ,,,
20,dieri,1741,,m i ɹ i,,,
21,dyaabugay,1741,,w a ŋ g a ɹ,,,
22,djambarrpuyngu,1741,,g a r w a ɹ,,,
24,djinang,1741,,g u r g i,,,
27,gamilaraay,1741,,ŋ u r i b a,,,
31,kumbainggar,1741,,w a ɹ u,,,
35,gupapuyngu,1741,,g a r w a ɹ,,,
36,gurindji,1741,,k a n k u l a,,,
38,guyani,1741,,k a ɹ a,,,
39,sydney,1741,,b u ɹ a w ɔ,,,
40,jaru,1741,,g a ŋ a n i,,,
41,jaru,1741,,g a ŋ a n i m a ɹ a ŋ o,,,
43,djiwarli,1741,,j i r a ɹ a,,,
44,kalkutung,1741,,p i r i n̪ a,,,
45,gamilaraay,1741,,ŋ g u r i b a,,,
46,karadjeri,1741,,k a n t i ŋ k a,,,
49,kartujarra,1741,,k a t u w a n a c a n u,,,
51,kaurna,1741,,k a r a,,,
53,kukatja,1741,,g a ŋ a ɹ a,,,
54,kukuyalanji,1741,,w a ŋ k a ɹ w a ŋ k a ɹ,,,
56,gurdjar,1741,,ŋ k aː ɖ,,,
57,gurdjar,1741,,ŋ k a ɖ i j a ŋ,,,
59,kalalagawya,1741,,g i m a l,,,
64,martuwangka,1741,,k a n k a,,,
68,mudburra,1741,,d i m b u,,,
70,muruwari,1741,,k a r a n t a,,,
72,ngaanyatjarra,1741,,k a n k a ɹ a r a,,,
75,ngamini,1741,,k u ɹ u m u,,,
77,ngarinman,1741,,d a l w i r,,,
79,ngarluma,1741,,g a n k a n m a n i,,,
80,narrinyeri,1741,,t̪ a l w u l d a,,,
85,northerncoastalnyangumarta,1741,,k a n k a,,,
86,nyamal,1741,,k a n k a ɭ a,,,
87,nyangumarta,1741,,k a n k a,,,
88,nyunga,1741,,j e a ɹ e ɹ,,,
91,panytyima,1741,,k a n k a l a,,,
92,banggarla,1741,,k a kː a nː a ɹ a,,,
93,bayungu,1741,,k a n k a ɹ a,,,
96,pitjantjatjara,1741,,k a t u,,,
97,pittapitta,1741,,j a k i ɭ i ŋ a l p a,,,
99,ritarungo,1741,,g a r w a ɹ,,,
100,dhalandji,1741,,k a n k a ɹ a,,,
101,dhargari,1741,,j i r a ɹ a,,,
104,wagaya,1741,,j u p a n t u,,,
105,wagaya,1741,,k i n k a ɭ,,,
106,wagaya,1741,,c e m a n t u ɹ u,,,
112,ngura,1741,,p i ʈ a b a d a,,,
115,warlpiri,1741,,k a n k a ɭ a ɳ i,,,
117,wanman,1741,,k a n k a ɳ i,,,
118,wariyangga,1741,,j i r a ɹ a,,,
119,warumungu,1741,,a ʈ t i n c i,,,
121,wathawurrung,1741,,k o b a ŋ i,,,
122,wathawurrung,1741,,k o m b a b a,,,
124,wikmungkan,1741,,w o ɲ a m,,,
125,wiradhuri,1741,,b i r a b a ŋ,,,
126,wirangunauo,1741,,g a ɖ i d j a,,,
131,yannhangu,1741,,g a ɳ g i j a,,,
132,yandruwandha,1741,,t̪ a l k a,,,
133,yandruwandha,1741,,k a n r a,,,
136,yawarawarga,1741,,d a t c a,,,
138,yindjibarndi,1741,,k a n k a ɭ a,,,
139,yortayorta,1741,,p u k u t,,,
141,yulparitja,1741,,k a n k a ɳ i ŋ u ɹ u,,,
142,yuwaalaraay,1741,,ŋ a r i b aː g i l i,,,
32948,adnyamathanha,1223,,j u ɭ k,,,
32950,alyawarr,1223,,ʈ a kʷ e ʈ,,,
32951,alyawarr,1223,,ʈ w a k e ʈ,,,
32953,arabana,1223,,ŋ a ɹ a,,,
32956,yugambehbandjalang,1223,,d u l g u,,,
32963,sydney,1223,,b u d b u t,,,
32965,dhuwal,1223,,ɖ o ʈ u r k,,,
32966,dieri,1223,,ŋ a ɹ a,,,
32967,dyaabugay,1223,,c i b a,,,
32968,djambarrpuyngu,1223,,ɖ o ʈ u r k,,,
32970,djinang,1223,,ɖ u ɹ k ɖ u ɹ k,,,
32974,gamilaraay,1223,,g iː,,,
32980,kumbainggar,1223,,b a r a n,,,
32984,gurindji,1223,,t u ɭ a ŋ,,,
32986,guyani,1223,,t̪ u l k u k a k a,,,
32987,sydney,1223,,b u d b u d,,,
32988,jaru,1223,,d u l u,,,
32989,djiwarli,1223,,p u ɹ uː l a,,,
32990,kalkutung,1223,,w a i r a,,,
32991,gamilaraay,1223,,g iː,,,
32992,karadjeri,1223,,b i l c o ɹ,,,
32994,kartujarra,1223,,k u ʈ u ʈ u,,,
32996,kaurna,1223,,b u l t a,,,
33000,kukatja,1223,,k u t u k u t u,,,
33004,gurdjar,1223,,e l,,,
33006,kalalagawya,1223,,ŋ a n a k a p,,,
33009,margany,1223,,u l g u,,,
33010,martuwangka,1223,,k u ʈ u ʈ u,,,
33018,mudburra,1223,,d u l a ŋ,,,
33019,muruwari,1223,,p u t̪ a n c,,,
33020,ngaanyatjarra,1223,,k u ʈ u ʈ u,,,
33022,lowerriverland,1223,,p u mː u ŋ,,,
33023,ngamini,1223,,ŋ a ɹ a,,,
257,adnyamathanha,98,,w a p u,,,
258,alyawarr,98,,e ŋ k e r,,,
259,arabana,98,,p ɹ a t c a n t a,,,
33028,ngarluma,1223,,b u l a ɖ a,,,
261,yugambehbandjalang,98,,g u m b i h,,,
267,dhangu,98,,w a r p a m ʔ,,,
268,dhuwal,98,,w a r p a m ʔ,,,
33037,nyangumarta,1223,,t u ɭ p u,,,
270,dieri,98,,p a r c a ɳ a,,,
271,dyaabugay,98,,ɲ i ŋ a j c a d a,,,
272,djambarrpuyngu,98,,b u k m a k,,,
33042,panytyima,1223,,p u l a ʈ a,,,
33043,banggarla,1223,,j u l g o m o k o,,,
33044,bayungu,1223,,p u ɹ uː l a,,,
277,gamilaraay,98,,g a n u,,,
33046,pittapitta,1223,,m a ɳ u,,,
280,kumbainggar,98,,b iː n,,,
33049,dhargari,1223,,p u ɹ uː l a,,,
284,gupapuyngu,98,,w a r p a m ʔ,,,
285,gurindji,98,,p u r pː a ɳ i,,,
287,guyani,98,,k u ɹ u,,,
288,jaru,98,,w a ɲ c u w u r a c a r a,,,
289,djiwarli,98,,ɖ a n,,,
290,gamilaraay,98,,g u n o,,,
291,karadjeri,98,,w a k a c,,,
33061,warlpiri,1223,,ɖ u k u ɖ u k u,,,
294,kartujarra,98,,j a ɳ ŋ a l a,,,
295,kaurna,98,,p a ʈ a nː a,,,
296,kukatja,98,,l a l t u,,,
297,kukuyalanji,98,,w u b u l,,,
33066,warumungu,1223,,m a ɳ t u l k a,,,
300,gurdjar,98,,w o k,,,
301,gurdjar,98,,β aː r,,,
302,kuukuyau,98,,m u k a m u k a n,,,
303,kalalagawya,98,,m u ɹ a,,,
33072,wiradhuri,1223,,g eː n,,,
33073,wirangunauo,1223,,g u ɖ u ɖ u,,,
306,margany,98,,b i r i ɲ,,,
307,martuwangka,98,,j a ɳ ŋ a,,,
311,mudburra,98,,k u w a ɲ c a,,,
33080,yandruwandha,1223,,m a ɳ u,,,
313,muruwari,98,,k u r u k u r u,,,
33082,yawarawarga,1223,,ŋ a ɹ a,,,
315,ngaanyatjarra,98,,p i ɳ i ɲ a ʈ u,,,
316,lowerriverland,98,,m u pː o,,,
317,ngamini,98,,p a r c a n a,,,
33086,yortayorta,1223,,d i p a,,,
319,ngarluma,98,,c u ɭ u,,,
320,narrinyeri,98,,t u l d a,,,
33089,yuwaalaraay,1223,,g iː,,,
323,northerncoastalnyangumarta,98,,w i r,,,
324,nyamal,98,,w iː r,,,
325,nyangumarta,98,,w i r,,,
326,nyunga,98,,b u n d u ŋ,,,
327,paakantyi,98,,g u d a g u d a,,,
328,panytyima,98,,c u ɭ u,,,
329,banggarla,98,,p a d l u j u n u,,,
330,bayungu,98,,w u r a j i m p a,,,
332,pitjantjatjara,98,,u w a n k a ɹ a,,,
333,pitjantjatjara,98,,w i n k i,,,
335,ritarungo,98,,w a r p a m ʔ,,,
338,wagaya,98,,m u k e ɭ,,,
345,ngura,98,,m a r u,,,
349,warlpiri,98,,m u k u,,,
350,warumungu,98,,m u kː u,,,
353,wikmungkan,98,,m a ˀm a ŋ k a m,,,
354,wiradhuri,98,,b i j a ŋ g a l a ŋ,,,
355,wirangunauo,98,,j a b u,,,
357,yannhangu,98,,b u k m a k,,,
358,yandruwandha,98,,m a l k a,,,
359,yandruwandha,98,,p a n i,,,
360,yandruwandha,98,,p a n i n a,,,
363,yawarawarga,98,,p a n i n a,,,
364,yindjibarndi,98,,c u l u,,,
365,yortayorta,98,,w u t a,,,
367,yulparitja,98,,l a l t u,,,
368,yuwaalaraay,98,,g a n u,,,
369,yuwaalaraay,98,,g a n u ŋ a w u,,,
370,yuwaalaraay,98,,g u r u g u r u,,,
371,yuwaalaraay,98,,aː b a l i,,,
372,adnyamathanha,1577,,a d n i,,,
373,arabana,1577,,n c u ɖ u,,,
375,yugambehbandjalang,1577,,ŋ u l a,,,
377,dhangu,1577,,g a,,,
380,dhuwal,1577,,g a,,,
382,dieri,1577,,j a,,,
383,dyaabugay,1577,,c a t a,,,
384,djambarrpuyngu,1577,,g a,,,
386,djinang,1577,,a,,,
389,gamilaraay,1577,,j i lː i b u,,,
391,kumbainggar,1577,,g a r aː,,,
392,kumbainggar,1577,,w a w,,,
393,kumbainggar,1577,,j u r g a,,,
397,gupapuyngu,1577,,g a,,,
398,gurindji,1577,,p u r p u r,,,
400,guyani,1577,,c u d ɹ u,,,
401,guyani,1577,,p u n t u n a,,,
402,guyani,1577,,c u n p a n a l u,,,
403,djiwarli,1577,,c i b i,,,
404,kalkutung,1577,,j a n a,,,
405,gamilaraay,1577,,j i lː i b u,,,
406,karadjeri,1577,,p a,,,
409,kartujarra,1577,,w i t u k a,,,
411,kaurna,1577,,k u m a,,,
413,kukatja,1577,,k a m u,,,
414,kukuyalanji,1577,,ŋ a r a,,,
416,gurdjar,1577,,a r,,,
417,kuukuyau,1577,,k u j i,,,
418,kalalagawya,1577,,a,,,
420,martuwangka,1577,,k a,,,
421,martuwangka,1577,,k aː,,,
425,muruwari,1577,,t̪ a k a,,,
426,ngaanyatjarra,1577,,k a,,,
428,lowerriverland,1577,,m eː t o,,,
429,lowerriverland,1577,,m e t k o,,,
430,ngamini,1577,,j a,,,
431,narrinyeri,1577,,u ŋ e n a ŋ,,,
435,northerncoastalnyangumarta,1577,,p a,,,
436,nyamal,1577,,p a,,,
437,nyangumarta,1577,,p a,,,
438,nyunga,1577,,g u ɖ c i ɹ,,,
439,paakantyi,1577,,ŋ a,,,
440,panytyima,1577,,k u n u,,,
441,banggarla,1577,,i n t o,,,
442,bayungu,1577,,c i b i,,,
443,pitjantjatjara,1577,,m u n u,,,
444,ritarungo,1577,,b i l i,,,
445,dhalandji,1577,,c i b i,,,
446,dhargari,1577,,p a ɹ u,,,
448,wagaya,1577,,p a,,,
456,warlpiri,1577,,m a n u,,,
457,wanman,1577,,k a m u,,,
458,wariyangga,1577,,c i p i,,,
459,warumungu,1577,,k a m i,,,
460,warumungu,1577,,k a p i,,,
461,wathawurrung,1577,,b aː,,,
463,wikmungkan,1577,,a ʔ,,,
464,wiradhuri,1577,,g a n̪ a ŋ,,,
465,wirangunauo,1577,,b a,,,
467,yannhangu,1577,,g a,,,
468,yandruwandha,1577,,j a,,,
469,yandruwandha,1577,,ŋ a,,,
471,yawarawarga,1577,,ŋ o k a,,,
472,yindjibarndi,1577,,m u n d u,,,
474,yulparitja,1577,,k a m u,,,
475,yuwaalaraay,1577,,g aː l a n̪ a,,,
960,adnyamathanha,646,,a ɖ ɭ a i m b a,,,
962,alyawarr,646,,e t n m e n t̪,,,
964,arabana,646,,p u d n̪ u,,,
968,yugambehbandjalang,646,,d i m a n,,,
969,yugambehbandjalang,646,,m u ɹ u h j n g,,,
970,yugambehbandjalang,646,,m u ɹ u j n c,,,
977,dhangu,646,,g a n u ʔ,,,
980,dhuwal,646,,ɭ i r g i,,,
982,dieri,646,,p u t a,,,
983,dyaabugay,646,,b u l ŋ a n,,,
984,djambarrpuyngu,646,,g a n u ʔ,,,
986,djinang,646,,g i b i l b a l,,,
989,gamilaraay,646,,g i r a n,,,
995,kumbainggar,646,,c u l aː r,,,
1000,gupapuyngu,646,,ɭ i r g i,,,
1001,gurindji,646,,c a n i,,,
1003,guyani,646,,d u l t a ɹ a,,,
1004,sydney,646,,d̪ u l a ɹ a,,,
1005,jaru,646,,b a l g a ɹ a,,,
1007,djiwarli,646,,ŋ a r i,,,
1009,kalkutung,646,,p u m p a,,,
1010,gamilaraay,646,,g i r a n,,,
1011,karadjeri,646,,p u l k a ɹ u,,,
1015,kartujarra,646,,c u ɳ p a,,,
1016,kaurna,646,,b u ʈ a,,,
1020,kukatja,646,,k a w a ɳ,,,
1021,kukuyalanji,646,,n u l u,,,
1026,gurdjar,646,,n oː ŋ,,,
1027,kuukuyau,646,,p u ɹ k a,,,
1029,kalalagawya,646,,t i b i,,,
1030,kalalagawya,646,,k u n a ɹ,,,
1036,margany,646,,b u d̪ a,,,
1037,martuwangka,646,,c u ɳ p a,,,
1046,mudburra,646,,w u bː a,,,
1048,muruwari,646,,p u t̪ a,,,
1051,ngaanyatjarra,646,,t c u ɳ p a,,,
1053,lowerriverland,646,,p u t k o,,,
1054,ngamini,646,,t u ɹ p a,,,
1056,ngarinman,646,,l i ɲ a ɖ,,,
1058,ngarluma,646,,m i r i ɲ,,,
1059,narrinyeri,646,,w i r a c e,,,
1066,northerncoastalnyangumarta,646,,p u ɳ t a,,,
1067,nyamal,646,,c u n p a,,,
1068,nyangumarta,646,,c u ɳ p a,,,
1069,nyunga,646,,b u ŋ a,,,
1070,paakantyi,646,,b a l b a,,,
1073,panytyima,646,,ŋ a r i,,,
1074,banggarla,646,,m u r u,,,
1075,bayungu,646,,ŋ a r i,,,
1080,pitjantjatjara,646,,t iː t iː,,,
1081,pittapitta,646,,p u n̪ u,,,
1083,ritarungo,646,,g a n u ʔ,,,
1084,dhalandji,646,,ŋ a r i,,,
1085,dhargari,646,,c i w a,,,
1088,wagaya,646,,n̪ a nː g u n̪ a nː g u,,,
1095,ngura,646,,g i n d a,,,
1101,warlpiri,646,,j a ɳ a n t i,,,
1103,wanman,646,,c u ɳ p a,,,
1104,wariyangga,646,,ŋ a r i,,,
1105,warumungu,646,,w u pː a,,,
1107,wathawurrung,646,,m a n a l,,,
1111,wikmungkan,646,,t̪ u m k u ɹ k,,,
1112,wiradhuri,646,,d̪ aː g uː n,,,
1113,wirangunauo,646,,m a b a ɭ a,,,
1117,yannhangu,646,,m u ŋ a,,,
1118,yandruwandha,646,,m u d u,,,
1120,yawarawarga,646,,m a k a p u d a,,,
1122,yindjibarndi,646,,j i w a ɖ a,,,
1124,yortayorta,646,,b a n a r u,,,
1126,yulparitja,646,,c u ɳ p a,,,
1127,yuwaalaraay,646,,g i r a n,,,
1128,adnyamathanha,1461,,ŋ a,,,
1132,dhangu,1461,,ŋ a,,,
1133,dhuwal,1461,,ŋ a,,,
1135,dieri,1461,,ŋ u,,,
1136,dyaabugay,1461,,l a,,,
1137,djambarrpuyngu,1461,,ŋ u ɹ,,,
1139,djinang,1461,,b a ɹ g i,,,
1141,gamilaraay,1461,,g a,,,
1144,kumbainggar,1461,,a,,,
1146,gupapuyngu,1461,,ŋ u ɹ a,,,
1147,sydney,1461,,w ɔ,,,
1148,jaru,1461,,l a,,,
1151,djiwarli,1461,,a,,,
1152,kalkutung,1461,,t̪ i,,,
1153,gamilaraay,1461,,g a,,,
1154,karadjeri,1461,,ŋ g a,,,
1156,kartujarra,1461,,ŋ k a,,,
1158,kukatja,1461,,t c a n i t c u r a,,,
1159,gurdjar,1461,,n p i l a ɲ,,,
1160,gurdjar,1461,,l m p i l a ɲ,,,
1161,kalalagawya,1461,,n u,,,
1164,martuwangka,1461,,c a,,,
1170,muruwari,1461,,a,,,
1172,ngarinman,1461,,l a ŋ k a k a c a k u l a,,,
1174,ngarluma,1461,,b u w i,,,
1175,narrinyeri,1461,,a n,,,
1178,northerncoastalnyangumarta,1461,,ŋ i,,,
1179,nyamal,1461,,ŋ u,,,
1180,nyangumarta,1461,,ŋ a,,,
1181,nyunga,1461,,j e a ɹ u ŋ e ɹ j u k i e,,,
1182,paakantyi,1461,,k a,,,
1183,panytyima,1461,,k a,,,
1184,bayungu,1461,,a,,,
1185,pitjantjatjara,1461,,ŋ k a,,,
1186,pittapitta,1461,,i n a,,,
1187,ritarungo,1461,,ŋ a ɹ a,,,
1188,dhalandji,1461,,a,,,
1189,dhargari,1461,,d a,,,
1194,ngura,1461,,l a ŋ a,,,
1196,warlpiri,1461,,ŋ k a,,,
1198,wanman,1461,,ŋ k a,,,
1199,wariyangga,1461,,d a,,,
1200,wiradhuri,1461,,d a,,,
1201,wirangunauo,1461,,ŋ a,,,
1203,yannhangu,1461,,ŋ k a,,,
1204,yandruwandha,1461,,j i,,,
1205,yindjibarndi,1461,,ɖ a,,,
1206,yulparitja,1461,,c a,,,
1207,yuwaalaraay,1461,,g a,,,
1208,adnyamathanha,1291,,i t i t i,,,
1210,alyawarr,1291,,a ʈ e p,,,
1211,alyawarr,1291,,a h e n c a h e n c,,,
1212,arabana,1291,,k u k u,,,
1216,yugambehbandjalang,1291,,m u b a ɹ j,,,
1217,yugambehbandjalang,1291,,m u l i g,,,
1218,yugambehbandjalang,1291,,w,,,
1219,yugambehbandjalang,1291,,m u l i h c,,,
1220,yugambehbandjalang,1291,,g i ɹ a ɹ w e,,,
1229,dhangu,1291,,b u ɳ ɖ a l ŋ u,,,
1231,sydney,1291,,b oː ʔ j oː,,,
1236,dhuwal,1291,,m u t a,,,
1238,dieri,1291,,k u l d u,,,
1239,dyaabugay,1291,,m u d u,,,
1240,djambarrpuyngu,1291,,m u t a,,,
1242,djinang,1291,,b u r g u ŋ i,,,
1247,gamilaraay,1291,,b a w a,,,
1253,kumbainggar,1291,,j iː b a,,,
1257,gupapuyngu,1291,,m u t a,,,
1258,gurindji,1291,,p a ɳ t a w u r u,,,
1262,guyani,1291,,m i l i ɹ i,,,
1263,sydney,1291,,g ɔ ɹ u b u l,,,
1264,jaru,1291,,n a ɹ a,,,
1266,djiwarli,1291,,c i m b i,,,
1268,kalkutung,1291,,m i ɲ c i,,,
1269,gamilaraay,1291,,b o,,,
1270,karadjeri,1291,,b a ɭ a ɹ,,,
34040,arabana,1371,,p a n t c a,,,
1274,kartujarra,1291,,m u r p u,,,
1276,kaurna,1291,,j u m o,,,
1280,kukatja,1291,,g a l g a,,,
1281,kukuyalanji,1291,,m u k u,,,
1286,gurdjar,1291,,β oː e ɖ,,,
1287,gurdjar,1291,,p oː e ɖ,,,
1288,gurdjar,1291,,m oː k i m e r,,,
1289,kuukuyau,1291,,m u c i,,,
1291,kalalagawya,1291,,k a l a,,,
34061,dhuwal,1371,,b u n ˀk u m u,,,
34062,dieri,1371,,p a n t c a,,,
34063,dyaabugay,1371,,b u ŋ g u,,,
1296,margany,1291,,b a ŋ a ɖ,,,
1297,martuwangka,1291,,c a ɳ a,,,
34066,djinang,1371,,b u n d i r i,,,
34071,gamilaraay,1371,,d̪ i n b i r,,,
34077,kumbainggar,1371,,b a g a b a g a,,,
1312,mudburra,1291,,c uː ɳ a,,,
34081,gurindji,1371,,t i ŋ a r i,,,
1314,muruwari,1291,,b i ɭ a,,,
34084,guyani,1371,,m a m p a,,,
1317,ngaanyatjarra,1291,,w i ʈ a p i,,,
34086,jaru,1371,,g i m a ɳ i,,,
34087,djiwarli,1371,,m u ʈ i,,,
1320,lowerriverland,1291,,k a m p k o,,,
1321,ngamini,1291,,k u l d ɹ u,,,
34090,kalkutung,1371,,i p u r u,,,
1323,ngarinman,1291,,b a n d a w u r u,,,
34092,karadjeri,1371,,m o n c o,,,
1325,ngarluma,1291,,m u r u,,,
1326,narrinyeri,1291,,t o l i,,,
34095,kartujarra,1371,,m u ʈ i,,,
34097,kaurna,1371,,m a m b a,,,
1332,northerncoastalnyangumarta,1291,,p i ɳ t i ɭ,,,
1333,nyamal,1291,,m u r u,,,
1334,nyangumarta,1291,,p i ɳ t i l,,,
1335,nyunga,1291,,g a m b u,,,
1336,paakantyi,1291,,ɖ a ɳ a,,,
1339,panytyima,1291,,m u r u,,,
1340,banggarla,1291,,j a ɖ n a,,,
1341,bayungu,1291,,m i g a,,,
34110,kalalagawya,1371,,k u l u,,,
1343,pitjantjatjara,1291,,t c a n a,,,
1344,pittapitta,1291,,k u k u,,,
1345,ritarungo,1291,,d i l t c i,,,
1346,dhalandji,1291,,m i g a,,,
1347,dhargari,1291,,c i ɭ i,,,
1350,wagaya,1291,,t oː ɹ a b a,,,
1356,ngura,1291,,w i t a,,,
34127,mudburra,1371,,d i ŋ a ɹ i,,,
1360,warlpiri,1291,,p u t u ɭ u,,,
1362,wanman,1291,,m u r p u,,,
1363,wariyangga,1291,,c i ɭ i,,,
1364,warumungu,1291,,k a ʈ t u ŋ k a,,,
34134,lowerriverland,1371,,p a r u ɹ u p,,,
34135,ngamini,1371,,p a n t c a,,,
34138,ngarinman,1371,,d i ŋ a r i,,,
1371,wikmungkan,1291,,k o j a m,,,
1372,wiradhuri,1291,,b i r a,,,
34141,narrinyeri,1371,,t̪ u t a ŋ a ŋ,,,
1379,yannhangu,1291,,ɖ i l t c i,,,
34148,northerncoastalnyangumarta,1371,,m u ʈ i ŋ i,,,
34149,nyamal,1371,,k a ŋ k u,,,
1382,yawarawarga,1291,,k u l d ɹ u,,,
34151,nyangumarta,1371,,m u ʈ i ŋ a,,,
34152,nyunga,1371,,p o o n i t,,,
34153,paakantyi,1371,,ɖ i ŋ i,,,
1386,yortayorta,1291,,b u nː uː t̪,,,
34156,panytyima,1371,,k a ŋ k u,,,
34157,banggarla,1371,,b o r a,,,
34158,bayungu,1371,,m u ɖ i ɲ g a c i,,,
34159,pittapitta,1371,,p u ɳ k u,,,
34163,dhalandji,1371,,m u ɖ i,,,
34164,dhargari,1371,,m u ɖ i,,,
34167,wagaya,1371,,i ɲ c i ɳ ŋ u,,,
34172,ngura,1371,,p u n k u l a,,,
34176,warlpiri,1371,,m i ɖ i,,,
34178,wanman,1371,,m u ɳ t u ɹ a,,,
34179,wariyangga,1371,,m u ʈ i,,,
34180,warumungu,1371,,m i ʈ i n p i,,,
34182,wathawurrung,1371,,b u n,,,
34186,wikmungkan,1371,,p u ŋ k,,,
34187,wiradhuri,1371,,b uː ŋ g a ŋ,,,
34188,wirangunauo,1371,,b u ɹ a,,,
34194,yannhangu,1371,,b o n,,,
34195,yandruwandha,1371,,p a n t c a,,,
34197,yawarawarga,1371,,p a n c a,,,
34199,yindjibarndi,1371,,m a ɳ b u r,,,
34201,yortayorta,1371,,j u k u n,,,
34203,yulparitja,1371,,m u ɳ t u r a,,,
34204,yuwaalaraay,1371,,d̪ i n b i r,,,
33026,ngarinman,1223,,d u ɭ b u,,,
33029,narrinyeri,1223,,ŋ e l e,,,
1588,adnyamathanha,1251,,w a ɭ a,,,
1590,alyawarr,1251,,a t n a a l t a,,,
1591,alyawarr,1251,,a t n e ʈ,,,
1593,arabana,1251,,k u d n a ɖ i,,,
1597,yugambehbandjalang,1251,,d oː l g o,,,
33035,northerncoastalnyangumarta,1223,,t u ɭ p u,,,
1606,dhangu,1251,,d̪ u l m u,,,
33036,nyamal,1223,,k u k u ʈ u k u ʈ u,,,
1612,dhuwal,1251,,w u w a ʔ,,,
1614,dieri,1251,,m a n d a,,,
1615,dyaabugay,1251,,b a l g u,,,
1616,djambarrpuyngu,1251,,d̪ u l m u,,,
1618,djinang,1251,,b u d c i r i,,,
33038,nyunga,1223,,k u ɖ u d u,,,
1624,gamilaraay,1251,,m u b a l,,,
33039,paakantyi,1223,,b u ɭ u,,,
1630,kumbainggar,1251,,b u l uː ɲ,,,
1635,gupapuyngu,1251,,w u w a ʔ,,,
1636,gurindji,1251,,m a c u l,,,
1639,guyani,1251,,k u d n a ŋ a m p i,,,
1640,sydney,1251,,u g a,,,
1641,jaru,1251,,m u n d a,,,
1643,djiwarli,1251,,ŋ a ɭ u,,,
274,djinang,98,,ŋ a j a m a,,,
1646,kalkutung,1251,,p u t u,,,
1647,gamilaraay,1251,,m u b a l,,,
1648,karadjeri,1251,,ŋ a ɭ u,,,
1652,kartujarra,1251,,ɲ u ɖ u,,,
1655,kaurna,1251,,m u n t o,,,
1660,kukatja,1251,,m u n d a,,,
1661,kukuyalanji,1251,,w a ɹ a l,,,
1667,gurdjar,1251,,w oː ɹ ɣ,,,
1668,gurdjar,1251,,n oː k i r,,,
1669,kuukuyau,1251,,k a p a n t a,,,
1671,kalalagawya,1251,,i e ɹ a,,,
1677,margany,1251,,b a ʈ i,,,
1678,martuwangka,1251,,w i ɭ a,,,
33048,dhalandji,1223,,p u ɹ uː l a,,,
1695,mudburra,1251,,m a c u l a,,,
1697,muruwari,1251,,d u g u,,,
1700,ngaanyatjarra,1251,,t c u n i,,,
1703,lowerriverland,1251,,m ə o u n k o,,,
1704,ngamini,1251,,t u n ɹ u,,,
33052,wagaya,1223,,k u ʈ u ɭ u,,,
1707,ngarinman,1251,,l u g u,,,
1709,ngarluma,1251,,p u ŋ a,,,
1710,narrinyeri,1251,,m a ŋ k e ɹ i,,,
1716,northerncoastalnyangumarta,1251,,ŋ u n t a p i n i,,,
1717,nyamal,1251,,ŋ a ɭ o,,,
1718,nyangumarta,1251,,ŋ a ɭ u,,,
1719,nyunga,1251,,c o ɹ p u l,,,
1720,paakantyi,1251,,g u n d u,,,
1724,panytyima,1251,,ŋ a ɭ u,,,
1725,banggarla,1251,,w u r n a,,,
1726,bayungu,1251,,p a ɭ u ɲ u,,,
1734,pitjantjatjara,1251,,c u n i,,,
1735,pitjantjatjara,1251,,m u k a l a,,,
1736,pittapitta,1251,,c u ɳ ʈ u,,,
1738,ritarungo,1251,,g u l u n,,,
1740,dhalandji,1251,,p a ɭ u ɲ u,,,
1741,dhargari,1251,,ŋ a ɭ u,,,
1744,wagaya,1251,,u t a l,,,
1751,ngura,1251,,ŋ a j i m a l a,,,
1757,warlpiri,1251,,m i j a l u,,,
1759,wanman,1251,,ɲ u ɹ u,,,
1760,wariyangga,1251,,p u c u,,,
1761,warumungu,1251,,m u n kː u,,,
1763,wathawurrung,1251,,d u ŋ,,,
1767,wikmungkan,1251,,t̪ i p,,,
1768,wiradhuri,1251,,b i n c i,,,
1769,wirangunauo,1251,,w a ɳ a,,,
33063,wanman,1223,,k u ʈ u ʈ u,,,
1775,yannhangu,1251,,ŋ a ɹ u,,,
1776,yandruwandha,1251,,t u n d ɹ u,,,
33064,wariyangga,1223,,p u ɖ a r,,,
1778,yawarawarga,1251,,b i lː i k u d n a,,,
1780,yindjibarndi,1251,,ŋ a ɭ u,,,
33065,warumungu,1223,,m a ɳ t u ɭ k a,,,
1784,yortayorta,1251,,b u l i,,,
1786,yulparitja,1251,,c u n i,,,
1787,yuwaalaraay,1251,,m u b a l,,,
33068,wathawurrung,1223,,d̪ u r u ŋ,,,
33071,wikmungkan,1223,,ŋ a ŋ k,,,
33079,yannhangu,1223,,ɖ u r ɖ u r,,,
33081,yandruwandha,1223,,t u p u r u,,,
33084,yindjibarndi,1223,,b u l a ɖ a,,,
33088,yulparitja,1223,,k u r u ɳ,,,
1951,adnyamathanha,1202,,ŋ a ɭ aː k a,,,
1953,alyawarr,1202,,i l kʷ a,,,
1956,arabana,1202,,k a t c i w i ɹ i,,,
1960,yugambehbandjalang,1202,,g i d j oː n,,,
1970,dhangu,1202,,b a t̪ a l a,,,
1971,sydney,1202,,m u r j,,,
1976,dhuwal,1202,,ɖ u m u r,,,
1978,dieri,1202,,p i ɳ a,,,
1979,dyaabugay,1202,,b a ŋ g a l,,,
1980,djambarrpuyngu,1202,,b a t̪ a l a,,,
1982,djinang,1202,,m a ɳ m i ɭ i ŋ,,,
1988,gamilaraay,1202,,b i d i,,,
1994,kumbainggar,1202,,b a r w a j,,,
1999,gupapuyngu,1202,,d̪ a m b u r u,,,
2000,gurindji,1202,,c a ŋ k a n i,,,
2003,guyani,1202,,ŋ u ɭ a,,,
2004,sydney,1202,,m u r j,,,
2005,jaru,1202,,a m b i,,,
2007,djiwarli,1202,,p a ɳ k a,,,
2010,kalkutung,1202,,j a ɳ m a ŋ u,,,
2011,gamilaraay,1202,,b u ɹ a l,,,
2012,karadjeri,1202,,w u ʈ u,,,
2016,kartujarra,1202,,m a c u w a ʈ a,,,
2019,kaurna,1202,,t a u a ɹ a,,,
2020,kaurna,1202,,p a ʈ o,,,
2025,kukatja,1202,,m a t c u,,,
2026,kukuyalanji,1202,,j a l b a u,,,
2027,kukuyalanji,1202,,j u k u,,,
2028,kukuyalanji,1202,,j a b a r a b a n,,,
2034,gurdjar,1202,,ŋ k u aː t̪,,,
2035,gurdjar,1202,,ɲ aː m i l,,,
2036,gurdjar,1202,,ʈ h o ɖ,,,
2037,kuukuyau,1202,,m u k a n,,,
2039,kalalagawya,1202,,k o i,,,
2044,margany,1202,,w a n b a,,,
2045,martuwangka,1202,,c a ɭ u,,,
2064,mudburra,1202,,d i c a,,,
2066,muruwari,1202,,t̪ aː t a,,,
47270,sydney,1225,,g a m a ɹ a,,,
2069,ngaanyatjarra,1202,,t c u k u m u n u,,,
2071,lowerriverland,1202,,j e ɳ k o,,,
2072,ngamini,1202,,p i ɳ a,,,
2075,ngarinman,1202,,ŋ a m a ɲ a n,,,
2077,ngarluma,1202,,m i r g a,,,
2078,narrinyeri,1202,,g ɹ a n t a l i,,,
2086,northerncoastalnyangumarta,1202,,w i ʈ u,,,
2087,nyamal,1202,,b oː t a,,,
2088,nyangumarta,1202,,w i ʈ u,,,
2089,nyunga,1202,,ŋ oː m o n,,,
2090,paakantyi,1202,,w e ʈ oː,,,
2093,panytyima,1202,,c i l i r a,,,
2094,banggarla,1202,,m i n u n d oː,,,
2095,bayungu,1202,,m i ɖ a l i,,,
2103,pitjantjatjara,1202,,p u ɭ k a,,,
2104,pittapitta,1202,,m a ŋ k u r a,,,
2106,ritarungo,1202,,d̪ a ɹ p a l,,,
2107,dhalandji,1202,,m i ɖ a l i,,,
2108,dhargari,1202,,p a ʈ g a,,,
2111,wagaya,1202,,p e ʈ i p,,,
2121,ngura,1202,,m i g a,,,
2126,warlpiri,1202,,w i ɹ i,,,
2128,wanman,1202,,c u m a,,,
2129,wariyangga,1202,,m i ɖ a,,,
2130,warumungu,1202,,k u m pː u,,,
2132,wathawurrung,1202,,d i d a b i l,,,
2136,wikmungkan,1202,,p iː ʔ a n,,,
2137,wiradhuri,1202,,b i n aː l,,,
2138,wirangunauo,1202,,b a ŋ a ɹ i,,,
2143,yannhangu,1202,,ɖ u m u r u,,,
2144,yandruwandha,1202,,p i ɳ a,,,
2147,yawarawarga,1202,,p i ɳ a,,,
2149,yindjibarndi,1202,,w a c i g a ɖ a,,,
2153,yortayorta,1202,,d u ŋ u d c a,,,
2155,yulparitja,1202,,c a ɭ u,,,
2156,yuwaalaraay,1202,,b u r u l,,,
2157,yuwaalaraay,1202,,b i d i,,,
2158,adnyamathanha,937,,k u ɹ u k u k u,,,
2159,alyawarr,937,,t̪ i p i ŋ w e ɹ e k i ŋ w e ɹ,,,
2161,arabana,937,,p a j a,,,
2165,yugambehbandjalang,937,,n u n z a j n b i l j,,,
2166,yugambehbandjalang,937,,j i ɹ i h j n g,,,
2167,yugambehbandjalang,937,,j i ɹ i ɹ i h j n c,,,
2168,yugambehbandjalang,937,,w i,,,
2169,yugambehbandjalang,937,,m a ɹ a h n c,,,
2170,yugambehbandjalang,937,,w,,,
2180,dhangu,937,,d c i k a j,,,
2182,sydney,937,,b i l i k i n,,,
2186,dhuwal,937,,d̪ a m i n,,,
2188,dieri,937,,p a j a,,,
2189,dyaabugay,937,,d i w i d i w i,,,
2190,djinang,937,,m a j p a l w a j k i ɳ i ŋ i,,,
2196,gamilaraay,937,,d̪ i g a ɹ aː,,,
2202,kumbainggar,937,,c iː b i ɲ,,,
2205,gupapuyngu,937,,d c i k a j,,,
2206,gurindji,937,,c u l a k,,,
2209,guyani,937,,d i t ɹ a,,,
2210,sydney,937,,p i nː i o n,,,
2211,jaru,937,,c i j i g a,,,
2213,djiwarli,937,,w a l a ŋ u,,,
2214,kalkutung,937,,u ɭ uː k u ɹ u,,,
2215,gamilaraay,937,,b u d j e ɹ,,,
2216,karadjeri,937,,b a n d a l m a d a,,,
2218,kartujarra,937,,c u k i c u k i,,,
2219,kaurna,937,,p a r i p a ɹ u,,,
2223,kukatja,937,,t u r u,,,
2224,kukuyalanji,937,,c i w a j,,,
2229,gurdjar,937,,eː ɲ,,,
2230,gurdjar,937,,eː ɲ m aː ɹ k a l i m,,,
2232,kalalagawya,937,,g u ɹ u ɹ u,,,
2236,margany,937,,b a j a,,,
2237,martuwangka,937,,p i l u ɳ p a,,,
2247,mudburra,937,,c u l a k a,,,
2249,muruwari,937,,t c u k i t c u k i,,,
2252,ngaanyatjarra,937,,t c i t a ʈ i,,,
2254,lowerriverland,937,,m ə a m,,,
2255,ngamini,937,,p a j a,,,
2257,ngarinman,937,,c u ɭ a g,,,
2259,ngarluma,937,,m u ɭ a,,,
2260,narrinyeri,937,,p u l d c a,,,
2266,northerncoastalnyangumarta,937,,w i ɹ u c a ʈ i ɲ,,,
2267,nyamal,937,,w i r u c a ʈ i ɲ,,,
2268,nyangumarta,937,,k a p a r k u,,,
2269,nyunga,937,,k e a ɖ,,,
2270,paakantyi,937,,b i ŋ g u,,,
2272,panytyima,937,,k a k i,,,
2273,banggarla,937,,i ʈ a,,,
2274,bayungu,937,,k a ɭ u ɳ k a b a c a,,,
2288,pitjantjatjara,937,,c u l p u,,,
2289,pittapitta,937,,p a j a,,,
2292,dhalandji,937,,k a r b a ɹ a,,,
2293,dhargari,937,,w a l a ŋ u,,,
2295,wagaya,937,,t̪ u t̪ u,,,
2303,ngura,937,,m a r a ŋ a,,,
2306,warlpiri,937,,c u ɭ p u,,,
2308,wanman,937,,l i m p i,,,
2309,wariyangga,937,,w a l a ŋ u,,,
