ID,Language_ID,Parameter_ID,Form,Segments,Comment,Source,form_in_source
23990,djambarrpuyngu,843,,g æ r ʔ,,,
23992,djinang,843,,g a r,,,
9460,gupapuyngu,1217,,d c a w u ɭ p a,,,
23994,gamilaraay,843,,k u r a,,,
23996,kumbainggar,843,,m a r a ŋ g a r g a,,,
24002,gupapuyngu,843,,g a r w i ɖ i,,,
24003,gurindji,843,,t a r u,,,
24006,guyani,843,,c u m p u,,,
24007,sydney,843,,m a ɹ a j i g ɔ ŋ,,,
24008,jaru,843,,j u m b u,,,
24010,djiwarli,843,,k a r a,,,
24011,kalkutung,843,,k u p u,,,
24012,gamilaraay,843,,k u r a,,,
24013,karadjeri,843,,w a ŋ g a r a ŋ g a r a,,,
24016,kartujarra,843,,t a p a r i,,,
24018,kaurna,843,,w a k o,,,
24022,kukatja,843,,g a ɹ b a i,,,
24023,kukuyalanji,843,,m a l a l,,,
24025,gurdjar,843,,l e ɖ,,,
24026,kuukuyau,843,,k aː t̪ a,,,
24027,kalalagawya,843,,e n t i,,,
24030,margany,843,,g a ɳ ɖ a,,,
24031,martuwangka,843,,t aː p a ɹ i,,,
24038,mudburra,843,,d a ɹ u,,,
24040,muruwari,843,,k a m p i k a m p i,,,
9468,djiwarli,1217,,m a ɳ d i,,,
24042,ngaanyatjarra,843,,w a ɳ k a,,,
24045,ngamini,843,,m a ɹ a n k a ɹ a,,,
24047,ngarinman,843,,m a ɹ a w u n,,,
24049,ngarluma,843,,g a n b a r,,,
24050,narrinyeri,843,,w a kː o w e,,,
24056,northerncoastalnyangumarta,843,,w a ŋ k a r u,,,
24057,nyamal,843,,k a r a ɹ u,,,
24058,nyangumarta,843,,w a ŋ k a r u,,,
24059,nyunga,843,,g a i ɹ a,,,
24060,paakantyi,843,,m a ɹ a m a ɹ aː k a,,,
24061,panytyima,843,,k a r a p a,,,
42264,northerncoastalnyangumarta,1435,,p u r c a p i n i,,,
24063,bayungu,843,,k a r a w a ɭ a,,,
42240,jaru,1435,,w i a u ŋ a n,,,
24067,pitjantjatjara,843,,w a ɳ k a,,,
24068,pittapitta,843,,k u p u,,,
24069,ritarungo,843,,g aː r,,,
24070,dhalandji,843,,m a ɹ u l u ɹ a,,,
24071,dhargari,843,,k a r a,,,
24074,wagaya,843,,u n p e ɳ u,,,
24079,ngura,843,,m a ɹ a w a ɳ d ɹ u w a ɳ d ɹ u,,,
24082,warlpiri,843,,j i n a r k i,,,
24084,wanman,843,,m a ɹ a p u l,,,
24085,warumungu,843,,k a ʈ a c a r a,,,
24087,wathawurrung,843,,b a ɳ a k a r i k,,,
24089,wikmungkan,843,,ŋ aː t,,,
24090,wiradhuri,843,,w i r j d e r o ŋ d e r o ŋ,,,
24091,wirangunauo,843,,i m b u,,,
24095,yandruwandha,843,,m a ɹ a ŋ a d a,,,
24097,yawarawarga,843,,m a ɹ a n k a ɹ a,,,
24099,yindjibarndi,843,,g a n b a r,,,
24102,yulparitja,843,,t aː p a ɹ i,,,
24103,adnyamathanha,1440,,ŋ a p a l j a,,,
24105,alyawarr,1440,,a p e l̪,,,
24107,arabana,1440,,ŋ a l t c a,,,
24110,yugambehbandjalang,1440,,c u b u ŋ,,,
9480,kaurna,1217,,ŋ a i c e ɭ i,,,
24117,dhangu,1440,,d̪ u p t̪ u n,,,
24119,sydney,1440,,j oː k eː,,,
24123,dhuwal,1440,,ŋ æ l,,,
24125,dieri,1440,,ŋ a l t a,,,
24126,dyaabugay,1440,,ɲ u m b a d a b a j,,,
24127,djambarrpuyngu,1440,,ŋ æ l,,,
24129,djinang,1440,,c u k m a r g i,,,
24133,gamilaraay,1440,,t̪ u b i lː a,,,
24138,kumbainggar,1440,,w a ɹ aː,,,
24142,gupapuyngu,1440,,d̪ u b a ʔʲ u n,,,
24143,gurindji,1440,,c a w u l,,,
24145,guyani,1440,,ŋ a l t c a,,,
24146,sydney,1440,,d j u ɹ a g a,,,
24147,jaru,1440,,d c i l d c i l,,,
9486,kukatja,1217,,ŋ aː b i,,,
24150,kalkutung,1440,,c a m p a r i t̪ i t i,,,
24151,gamilaraay,1440,,t̪ u b i lː a,,,
24152,karadjeri,1440,,c u l p a j i j i n t a n p a c a ŋ u l j,,,
42255,muruwari,1435,,w a ŋ a,,,
24156,kartujarra,1440,,c a ŋ a,,,
24158,kaurna,1440,,t a d l i b a tː e n d i,,,
24162,kukatja,1440,,ɲ iː l i,,,
24163,kukuyalanji,1440,,ɲ u m b a,,,
24168,gurdjar,1440,,ɣ i t̪,,,
24170,kalalagawya,1440,,m o s a l a d a i,,,
24174,margany,1440,,ŋ a l j i,,,
24175,martuwangka,1440,,c a ŋ a,,,
24184,mudburra,1440,,c a l k i r a,,,
24186,muruwari,1440,,k a ŋ k u l,,,
24189,ngaanyatjarra,1440,,w i ʈ a,,,
24191,lowerriverland,1440,,k ə u t,,,
24192,ngamini,1440,,ŋ a l j c a,,,
24194,ngarinman,1440,,c a w u l,,,
24196,ngarluma,1440,,w i t̪ a ɭ a ŋ a j i,,,
24197,narrinyeri,1440,,t i n k u n d u n,,,
24203,northerncoastalnyangumarta,1440,,c a ŋ a p i n i,,,
24204,nyamal,1440,,w i c a,,,
24205,nyangumarta,1440,,c a ŋ a,,,
24206,nyunga,1440,,d̪ eː l j,,,
24207,paakantyi,1440,,t̪ u p a,,,
24209,panytyima,1440,,w i t̪ a,,,
24210,banggarla,1440,,ŋ a pː a l j a,,,
24211,bayungu,1440,,w i g i w i r i m a,,,
24215,pitjantjatjara,1440,,w i t a,,,
24216,pittapitta,1440,,ŋ a l j c a,,,
24218,ritarungo,1440,,d̪ u p t̪ u n,,,
24220,dhalandji,1440,,w i g i,,,
24221,dhargari,1440,,w i g i,,,
24224,wagaya,1440,,n u n t̪ u,,,
24231,ngura,1440,,ŋ a l t c a,,,
24235,warlpiri,1440,,ɲ i ɲ p a,,,
24236,warlpiri,1440,,ɲ u ɲ p a,,,
24238,wanman,1440,,c a ŋ a,,,
24239,wariyangga,1440,,w i g i,,,
24240,warumungu,1440,,ɲ u j u,,,
42270,banggarla,1435,,j e ɭ a,,,
24245,wikmungkan,1440,,t̪ aː ʔ t̪ eː k a ŋ m a k a ŋ,,,
24246,wiradhuri,1440,,d uː m b a,,,
24247,wirangunauo,1440,,ŋ a l d j a,,,
24252,yandruwandha,1440,,ŋ a l t c a,,,
24255,yawarawarga,1440,,ŋ a t c a,,,
24257,yindjibarndi,1440,,w i l̪ a ŋ g a g u,,,
24259,yortayorta,1440,,m u l a n d c i k a,,,
24261,yulparitja,1440,,c a l a,,,
24262,yuwaalaraay,1440,,d̪ u b i l i,,,
24263,adnyamathanha,1437,,i ŋ g i i ŋ g i,,,
24264,alyawarr,1437,,a k a l t̪ e j e l,,,
24265,arabana,1437,,p a l k a p a l k a,,,
24268,yugambehbandjalang,1437,,d u n m a,,,
24273,dhangu,1437,,b a ʈ h u n,,,
24274,sydney,1437,,m a g a l,,,
24278,dieri,1437,,p a l k a,,,
24279,dyaabugay,1437,,g a l a b a r a j,,,
24280,djinang,1437,,b a r b i ɭ,,,
24283,gamilaraay,1437,,β a ɹ u n i,,,
24285,kumbainggar,1437,,g a g aː ɭ a,,,
24287,gupapuyngu,1437,,b a l b a w ˀm a ɹ a m a,,,
24288,gurindji,1437,,c a ɭ a l p a n a n a,,,
24289,guyani,1437,,k u l a ɹ i n t a,,,
24290,sydney,1437,,m i g a l,,,
24291,jaru,1437,,d c a l a d b a i a ɹ a,,,
24293,djiwarli,1437,,w a n d a m a ɹ u,,,
24295,gamilaraay,1437,,β a ɹ u n i,,,
24296,karadjeri,1437,,g a ɹ,,,
24298,kartujarra,1437,,j a r p u,,,
24300,kaurna,1437,,m e k a u w e,,,
24303,kukatja,1437,,l a k a ɳ p u w a,,,
24304,kukuyalanji,1437,,j i k a d a m a l,,,
24305,kukuyalanji,1437,,b u ɹ u w a r i,,,
24307,gurdjar,1437,,ɖ aː r,,,
24308,kuukuyau,1437,,p a l n t a n a,,,
24309,kalalagawya,1437,,ŋ u d i,,,
24311,margany,1437,,d̪ a ɖ u,,,
24312,martuwangka,1437,,j a r k a t i ŋ u,,,
24315,mudburra,1437,,d i l,,,
24317,muruwari,1437,,p a ŋ a,,,
24318,ngaanyatjarra,1437,,t a m p i r aː ɳ u,,,
24319,lowerriverland,1437,,ɹ a d l j u n,,,
24320,ngamini,1437,,p a l k a,,,
24322,ngarluma,1437,,g a ɳ d a,,,
24323,narrinyeri,1437,,t̪ ɹ a t u ŋ,,,
24328,northerncoastalnyangumarta,1437,,j i l j u,,,
24329,nyamal,1437,,ɭ aː ɹ p i,,,
24330,nyangumarta,1437,,j i l j u,,,
24331,nyunga,1437,,m a i l j u t,,,
24332,paakantyi,1437,,ɖ a ɭ a ɖ a ɭ a,,,
24334,banggarla,1437,,p u tː u t u,,,
24335,bayungu,1437,,k a ɳ d a,,,
24344,pitjantjatjara,1437,,t c i l p i ɹ p u ŋ a ɲ i,,,
24345,pittapitta,1437,,p a l k a,,,
24346,ritarungo,1437,,b a r ʔʲ u n,,,
24348,dhalandji,1437,,k a ɳ d a,,,
24349,dhargari,1437,,w a ɹ a r g a ɹ u,,,
24352,wagaya,1437,,l u w a m,,,
24356,ngura,1437,,i l ɹ i,,,
24359,warlpiri,1437,,l a r a j a n i,,,
24361,wanman,1437,,ɭ aː r p u,,,
24362,wariyangga,1437,,w a n d a b a l a ʔ,,,
24363,warumungu,1437,,t i ɭ,,,
24365,wathawurrung,1437,,d u r u m a,,,
24366,wikmungkan,1437,,j eː p a n a t̪ a ŋ,,,
24367,wiradhuri,1437,,b a ɹ a r w a r a,,,
24368,wirangunauo,1437,,b a ŋ g a ɳ,,,
24371,yandruwandha,1437,,k u d ɹ i k u d ɹ i n a,,,
24372,yandruwandha,1437,,j a l b a,,,
24373,yawarawarga,1437,,p u ɹ i c i n d ɹ i ɹ i,,,
24375,yindjibarndi,1437,,t̪ aː ɖ a,,,
24377,yulparitja,1437,,l a l a p u w a,,,
24378,yuwaalaraay,1437,,b aː r a j,,,
24379,adnyamathanha,1414,,j u d̪ n̪ i,,,
24380,arabana,1414,,t a ɹ p a n t a,,,
24383,yugambehbandjalang,1414,,ŋ iː m a,,,
24387,dhangu,1414,,j i ɳ ɖ a m,,,
9526,lowerriverland,1217,,n u kː u w u ɹ,,,
24391,dieri,1414,,c i ɹ b a n t a,,,
24392,dyaabugay,1414,,d c u l m a l,,,
24393,djinang,1414,,ɖ u c i g i,,,
24395,kumbainggar,1414,,b aː l m a,,,
24396,gupapuyngu,1414,,ɖ i t c p u n u m a,,,
24397,gurindji,1414,,c u l j m i p m a n a n a,,,
24398,guyani,1414,,k a n c i n t a,,,
24399,sydney,1414,,d i m a,,,
24400,jaru,1414,,c a ɲ b u ŋ a n,,,
24402,djiwarli,1414,,t̪ u ɲ i ɹ u,,,
24404,kalkutung,1414,,a l m i,,,
24405,karadjeri,1414,,c u l j p u ɲ a,,,
24406,kartujarra,1414,,ɲ u p i,,,
24407,kaurna,1414,,b a ɳ d a n d i,,,
24411,kukatja,1414,,ɲ a n t u r,,,
24412,kukuyalanji,1414,,d i ŋ k a l,,,
24415,gurdjar,1414,,ɖ i ŋ k,,,
24416,gurdjar,1414,,n eː r i m a n t̪ ɲ i l k,,,
24417,kuukuyau,1414,,m a n m a c i n a,,,
24418,kalalagawya,1414,,s a s i m a i,,,
24421,martuwangka,1414,,c u ɲ i ɳ u,,,
9532,ngarluma,1217,,c a b u,,,
24426,mudburra,1414,,b i c a r k w a ɳ d a,,,
24428,muruwari,1414,,t̪ u n m a,,,
24429,ngaanyatjarra,1414,,t c u l k u ɳ u,,,
24430,lowerriverland,1414,,p a i ŋ u n,,,
24431,ngamini,1414,,c i ɹ p a n a,,,
24432,ngarluma,1414,,c u m p i l k u,,,
24433,narrinyeri,1414,,t o k u n,,,
24436,northerncoastalnyangumarta,1414,,t u l j p i n i,,,
24437,nyamal,1414,,c u m p i,,,
24438,nyangumarta,1414,,c u ɲ i ɳ i,,,
24439,nyunga,1414,,b eː n g u ɹ,,,
24440,paakantyi,1414,,ɖ u ɹ a,,,
24442,banggarla,1414,,n i l k a t a,,,
24443,bayungu,1414,,w a n m a n m a,,,
24444,pitjantjatjara,1414,,ɲ u ɹ m i n t a n a ɲ i,,,
24445,pittapitta,1414,,n̪ u l̪ i,,,
24446,dhalandji,1414,,c u ɲ i l g i n,,,
24447,dhargari,1414,,t̪ u ɲ i ɹ u,,,
24453,warlpiri,1414,,t u ɭ k a m i,,,
24455,wanman,1414,,k a ʈ i m a,,,
24456,wariyangga,1414,,t̪ u ɲ i ɹ u,,,
24457,warumungu,1414,,m u ɲ u r k u n t a,,,
24458,warumungu,1414,,c u l j k u n t a,,,
24460,wikmungkan,1414,,t̪ i m a ŋ,,,
24461,wiradhuri,1414,,d u l m a r a,,,
24462,wirangunauo,1414,,g a j i ɳ,,,
24465,yannhangu,1414,,b u ɖ u r u t c u n,,,
24466,yandruwandha,1414,,n a n k a ɹ i,,,
24467,yawarawarga,1414,,n a n k i n d ɹ i,,,
24468,yindjibarndi,1414,,c u m b i g u,,,
24470,yulparitja,1414,,t i l j a l a,,,
24473,yugambehbandjalang,1434,,b u g a,,,
24478,dhangu,1434,,b a r t c u n,,,
24482,dhuwal,1434,,b a r t c u n,,,
24484,dieri,1434,,d a k a,,,
24485,dyaabugay,1434,,b a g a l,,,
24486,djambarrpuyngu,1434,,b a r c u n,,,
24488,djinang,1434,,ɹ a n i,,,
24491,gamilaraay,1434,,d̪ u n i,,,
24494,kumbainggar,1434,,b a w g a,,,
24496,gupapuyngu,1434,,d̪ æ m a l k u m a,,,
24497,gurindji,1434,,k u r p j u w a n a n a,,,
24499,sydney,1434,,d oː ɹ a,,,
24500,jaru,1434,,c u d l a n a n,,,
24502,djiwarli,1434,,n̪ a n d i m a n a ŋ g u,,,
24504,kalkutung,1434,,ŋ k a,,,
24505,gamilaraay,1434,,d̪ u n i,,,
24506,kartujarra,1434,,w a k a,,,
24507,kaurna,1434,,p u ŋ g o n d i,,,
24511,kukatja,1434,,m u r u t c u r a,,,
24512,kukuyalanji,1434,,b a k a,,,
24514,gurdjar,1434,,ɖ i ŋ k,,,
24515,gurdjar,1434,,ŋ k,,,
24516,gurdjar,1434,,m o ɹ i ɖ i ŋ k,,,
24517,gurdjar,1434,,m o ɹ i w i l k,,,
24519,kalalagawya,1434,,p a g a,,,
24520,margany,1434,,b a b a,,,
24521,martuwangka,1434,,w a k a ɳ u,,,
24525,mudburra,1434,,k a ɳ a,,,
24527,muruwari,1434,,p i ŋ k a,,,
24529,ngarinman,1434,,d u r b b u ɲ a,,,
24530,ngarluma,1434,,g a ɖ a g a,,,
24531,narrinyeri,1434,,t o l k u n d u n,,,
24535,northerncoastalnyangumarta,1434,,j a ɳ t a,,,
24536,nyunga,1434,,d̪ a n,,,
24537,paakantyi,1434,,p a n t a,,,
24538,panytyima,1434,,k a ʈ a l k u,,,
24539,banggarla,1434,,n u w u t u,,,
24540,bayungu,1434,,t̪ a r a ɲ c i n m a,,,
24541,pitjantjatjara,1434,,w a k a ɳ i,,,
24542,pittapitta,1434,,k a n a ŋ k a,,,
24543,ritarungo,1434,,b a r t c u n,,,
24544,dhalandji,1434,,k a ɖ a l g i n,,,
24545,dhargari,1434,,c a ʈ a w iː ɹ u,,,
24547,wagaya,1434,,t̪ i n k u j i,,,
24549,ngura,1434,,k a l a ɹ a,,,
24552,warlpiri,1434,,t u ɭ t u r p a n t i ɳ i,,,
24554,wanman,1434,,w a k a l a,,,
24555,wariyangga,1434,,n̪ a n d i m a n a ŋ g u,,,
24556,warumungu,1434,,t a ɭ k u r p a k a n t a,,,
24558,wathawurrung,1434,,b a n a,,,
24560,wikmungkan,1434,,t̪ aː n a t̪,,,
24561,wiradhuri,1434,,d u nː a,,,
24562,wirangunauo,1434,,b a ɭ d a ɳ,,,
24563,yandruwandha,1434,,d ɹ a k a,,,
24566,yindjibarndi,1434,,g a ɖ a ʔ a,,,
24567,yortayorta,1434,,b a d i m,,,
24568,yulparitja,1434,,w a k a l a,,,
24569,yuwaalaraay,1434,,d̪ u r i,,,
24570,adnyamathanha,1442,,j u w a,,,
24571,adnyamathanha,1442,,j i w a,,,
24573,alyawarr,1442,,i t n e j e l,,,
24575,arabana,1442,,t̪ a ɹ k a,,,
24579,yugambehbandjalang,1442,,c a h n a,,,
24588,dhangu,1442,,d̪ æ r a,,,
24590,sydney,1442,,t a ɹ a k e,,,
24595,dhuwal,1442,,b i r,,,
24597,dieri,1442,,t̪ a r k a,,,
24598,dyaabugay,1442,,c a n a j,,,
24599,djambarrpuyngu,1442,,b i r,,,
24601,djinang,1442,,d c i r d c i,,,
24605,gamilaraay,1442,,w u r a i,,,
24610,kumbainggar,1442,,c a g a ɲ c i,,,
24613,gupapuyngu,1442,,b i r,,,
24614,gurindji,1442,,k u ʈ i c k a r i ɲ a n a,,,
24616,sydney,1442,,w a r eː w eː,,,
24617,jaru,1442,,c a d a ɲ a ŋ a n,,,
24619,djiwarli,1442,,j u g a r i a,,,
24621,kalkutung,1442,,ɳ a,,,
24622,gamilaraay,1442,,w u r a i,,,
24623,karadjeri,1442,,g a ɹ b i l a,,,
24626,kartujarra,1442,,ŋ a ɖ a,,,
24627,kaurna,1442,,j u w a n d i,,,
24632,kukatja,1442,,ŋ a ɹ a,,,
24633,kukuyalanji,1442,,c a n a,,,
24637,gurdjar,1442,,eː n i k,,,
24638,kuukuyau,1442,,p aː ʔ i n a,,,
24640,kalalagawya,1442,,s i k a,,,
24645,margany,1442,,d̪ a n a,,,
24646,martuwangka,1442,,ŋ a ɹ a ŋ u,,,
24658,mudburra,1442,,k u t i c,,,
24660,muruwari,1442,,t̪ i n a,,,
24661,ngaanyatjarra,1442,,ŋ a ɹ a k u,,,
24663,ngamini,1442,,t a ɹ k a,,,
24665,ngarinman,1442,,g u d i c g a r i ɲ a,,,
24667,ngarluma,1442,,k a r i k u,,,
24668,narrinyeri,1442,,t a ŋ g e l u,,,
24675,northerncoastalnyangumarta,1442,,w a ɹ a r k a r i ɲ i,,,
24676,nyamal,1442,,w u ʈ a r i,,,
24677,nyangumarta,1442,,w a ɹ a r k a r i ɲ i,,,
24678,nyunga,1442,,j u k,,,
24679,paakantyi,1442,,d̪ aː r i,,,
24683,panytyima,1442,,k a r i,,,
24684,bayungu,1442,,j u g a r i m a,,,
24686,pitjantjatjara,1442,,ŋ a ɹ a ɲ i,,,
24687,pittapitta,1442,,t̪ a r h k a,,,
24690,ritarungo,1442,,d̪ aː r a,,,
24692,dhalandji,1442,,j u g a r i n,,,
24693,dhargari,1442,,j u g a r i a,,,
24696,wagaya,1442,,k i r e w i r,,,
24703,ngura,1442,,t̪ i n a,,,
24708,warlpiri,1442,,k a r i m i,,,
24710,wanman,1442,,k a r i,,,
24711,wariyangga,1442,,j u g a r i a,,,
24712,warumungu,1442,,c a n t a,,,
24714,wathawurrung,1442,,d c a r i k a,,,
24717,wikmungkan,1442,,t̪ a n a ŋ,,,
24718,wiradhuri,1442,,w u r u n a,,,
24719,wirangunauo,1442,,j u g a ɳ,,,
24725,yannhangu,1442,,b a m p a r a,,,
24726,yandruwandha,1442,,t a ŋ g u,,,
24729,yindjibarndi,1442,,g a r i,,,
24731,yortayorta,1442,,g a n b i n a,,,
24733,yulparitja,1442,,ŋ a ɹ a,,,
24734,yuwaalaraay,1442,,w a r a j m a l i,,,
24735,adnyamathanha,1430,,v u ɖ l i,,,
24737,alyawarr,1430,,a n c a r,,,
24739,arabana,1430,,k a ɖ i p i l a,,,
24743,yugambehbandjalang,1430,,c oː j u m g u n,,,
24751,dhangu,1430,,g a ɲ u,,,
24753,sydney,1430,,c o w,,,
24758,dhuwal,1430,,b a ʈ t c u r,,,
24760,dieri,1430,,d i c i w a k a,,,
24761,dyaabugay,1430,,g a w a j,,,
24762,djambarrpuyngu,1430,,g a ɲ u,,,
24764,djinang,1430,,g a t a,,,
24769,gamilaraay,1430,,m i ɹ iː,,,
24775,kumbainggar,1430,,b i ɹ aː l,,,
24780,gupapuyngu,1430,,g a ɲ u,,,
24781,gurindji,1430,,k i k i,,,
24784,guyani,1430,,p u d l i,,,
24785,sydney,1430,,b i r a ŋ,,,
24786,jaru,1430,,w a d a,,,
24788,djiwarli,1430,,k u ɹ u b i r i,,,
24791,kalkutung,1430,,c i r k a,,,
24792,gamilaraay,1430,,m i r e,,,
24793,karadjeri,1430,,w i ɹ i ɲ,,,
24797,kartujarra,1430,,k u ʈ a ɭ a,,,
24800,kaurna,1430,,w a j a kː a,,,
24805,kukatja,1430,,k u ʈ a l j a,,,
24806,kukuyalanji,1430,,d a w a ɹ,,,
24813,gurdjar,1430,,ɖ aː m p i r,,,
24814,kuukuyau,1430,,t̪ iː t̪ i,,,
24816,kalalagawya,1430,,t i t o i,,,
24823,margany,1430,,n i j a ɖ u,,,
24824,martuwangka,1430,,k u ʈ a l j a,,,
24841,mudburra,1430,,c i n k i c i,,,
24843,muruwari,1430,,m i r i n c,,,
24846,ngaanyatjarra,1430,,p i ɳ t i r i,,,
24850,lowerriverland,1430,,p e d l i,,,
24851,ngamini,1430,,d i d j i d a l ɹ a,,,
24854,ngarinman,1430,,m i l j c i w u ɳ,,,
24856,ngarluma,1430,,b i ɳ d i r i,,,
24857,narrinyeri,1430,,t̪ u l a,,,
24865,northerncoastalnyangumarta,1430,,p a n i k i t i,,,
24866,nyamal,1430,,p e t a,,,
24867,nyangumarta,1430,,p a n i k a t a,,,
24868,nyunga,1430,,ŋ u ŋ g a l,,,
24869,paakantyi,1430,,p oː l i a,,,
24870,paakantyi,1430,,b u ɭ e,,,
24873,panytyima,1430,,b i n d i r i,,,
24874,banggarla,1430,,b oː ɖ l i,,,
24875,bayungu,1430,,p a ɖ a ɹ a,,,
24880,pitjantjatjara,1430,,k i l i l p i,,,
24881,pittapitta,1430,,c i n p i,,,
24884,ritarungo,1430,,d̪ a p a ɭ k,,,
24886,dhalandji,1430,,k u ɹ u l j a n u,,,
24887,dhargari,1430,,p a ɖ a ɹ a,,,
24890,wagaya,1430,,c e w i c a w u,,,
24897,ngura,1430,,d i t c i,,,
24902,warlpiri,1430,,j a n c i l j p i ɹ i,,,
24904,wanman,1430,,k u ʈ a l j a,,,
24905,wariyangga,1430,,k u ɹ u b i r i,,,
24906,warumungu,1430,,l u k u n u,,,
24907,warumungu,1430,,l u kː u n u,,,
24908,warumungu,1430,,w u ɭ u k u n u,,,
24909,wathawurrung,1430,,t u ʈ b a r a m,,,
24913,wikmungkan,1430,,ŋ u c,,,
24914,wiradhuri,1430,,m i m a,,,
24915,wirangunauo,1430,,g a l g a,,,
24921,yannhangu,1430,,b a ɳ u m b i r,,,
24922,yandruwandha,1430,,d ɹ i t c i,,,
24925,yawarawarga,1430,,k u l i,,,
24927,yindjibarndi,1430,,b i ɳ d i r i,,,
24931,yortayorta,1430,,d u t a n,,,
24933,yulparitja,1430,,k i k i,,,
24934,yuwaalaraay,1430,,g a u b a ɹ i,,,
24935,adnyamathanha,713,,m a m a,,,
24936,arabana,713,,c e l c a t i ɹ i m a n i n t a,,,
24939,yugambehbandjalang,713,,w i h ɹ g a,,,
24947,dhangu,713,,d c a w ʔ,,,
24949,sydney,713,,k u ɹ ɹ a ʔ m a,,,
24953,dhuwal,713,,d c a w ʔ,,,
24954,dieri,713,,m a m a,,,
24955,dyaabugay,713,,c u ŋ g a r i l,,,
24956,djambarrpuyngu,713,,d c a w ʔ,,,
24958,djinang,713,,c a m i r g i,,,
24960,gamilaraay,713,,g a r a m a l i,,,
24964,kumbainggar,713,,w u r u g u ɲ m a,,,
24968,gupapuyngu,713,,d c a w ʔ,,,
24969,gurindji,713,,c a w u r a m a n a n a,,,
24972,guyani,713,,p u d l i n k u m a n k u t a,,,
24973,sydney,713,,k a ɹ a m a,,,
24974,jaru,713,,ŋ u ɹ u m a n a,,,
24976,djiwarli,713,,c u m b u ɭ a ɹ u,,,
24978,kalkutung,713,,n̪ i t̪ a,,,
24979,gamilaraay,713,,k a ɹ a m u lː e,,,
24980,karadjeri,713,,ŋ u r u m a ɲ a,,,
24983,kaurna,713,,m e tː e n d i,,,
24984,kaurna,713,,m e tː e ɹ e n d i,,,
24985,kukatja,713,,m a ɹ u m a r a,,,
24986,kukuyalanji,713,,ŋ a k i l,,,
24989,gurdjar,713,,m o ɖ o m p i l k,,,
24990,gurdjar,713,,w e l β a ŋ k m a n k,,,
24991,gurdjar,713,,w i l k,,,
24992,kuukuyau,713,,p aː l n t a ɲ a,,,
24994,kalalagawya,713,,p u ɹ u n u w a s a m i,,,
24998,margany,713,,g u n̪ d̪ a,,,
25006,mudburra,713,,j u r u b,,,
25008,muruwari,713,,ŋ a ɹ p a,,,
25011,lowerriverland,713,,j a tː u lː e m u n,,,
25012,ngamini,713,,k u ɹ u m i m a n t a,,,
25014,ngarluma,713,,m u c a,,,
25015,narrinyeri,713,,p e t̪ u n,,,
25022,northerncoastalnyangumarta,713,,m u r i l u,,,
25023,nyamal,713,,m u r i l u,,,
25024,nyunga,713,,u j p u l,,,
25025,paakantyi,713,,g a ɳ m a,,,
25026,panytyima,713,,m i l j u l a l k u,,,
25027,banggarla,713,,m e n a n d a,,,
25028,bayungu,713,,c u n d u n m a,,,
25035,pitjantjatjara,713,,k u t i t c u n a ɲ i,,,
25036,pittapitta,713,,n̪ i t̪ a,,,
25037,ritarungo,713,,b a l k m a ɹ a m a,,,
25038,dhalandji,713,,m u c i j a l g i n,,,
25039,dhargari,713,,m u j i ɹ a ɹ u,,,
25040,wagaya,713,,m u n u k a,,,
25044,ngura,713,,m a m a,,,
25049,warlpiri,713,,p u ɹ u n c u,,,
25051,wariyangga,713,,m u c i j a ɹ u,,,
25052,warumungu,713,,w u ɹ u l j p a ɹ a n c a n,,,
25054,wathawurrung,713,,p i l m,,,
25056,wikmungkan,713,,m a ʔ k u c a t̪ a ŋ,,,
25057,wiradhuri,713,,m a ŋ g i,,,
25061,yannhangu,713,,d c a w ʔʲ u n,,,
25062,yandruwandha,713,,m a m a,,,
25063,yandruwandha,713,,m a m a t̪ i k a,,,
25064,yandruwandha,713,,w i n k a m a,,,
25066,yawarawarga,713,,k i ŋ i l i m a n d ɹ i n d ɹ i,,,
25067,yindjibarndi,713,,m u j a g u,,,
25069,yortayorta,713,,b i t̪ a,,,
25071,yulparitja,713,,ŋ u l j u m a n a j i n,,,
25072,yuwaalaraay,713,,m a n u m a l i,,,
25073,adnyamathanha,906,,w i ʈ i,,,
25075,alyawarr,906,,a r w e ɭ ɭ t w a,,,
25077,arabana,906,,m u p u,,,
25081,yugambehbandjalang,906,,c a l i,,,
25091,dhangu,906,,d̪ a ɹ p a,,,
25093,sydney,906,,w a dː e,,,
25098,dhuwal,906,,g æ j u,,,
25100,dieri,906,,p i ʈ a,,,
25101,dyaabugay,906,,c u l b i n,,,
25102,djambarrpuyngu,906,,g æ j u,,,
25104,djinang,906,,g u r t c i,,,
25109,gamilaraay,906,,d̪ u l u,,,
25115,kumbainggar,906,,b i g uː r,,,
25120,gupapuyngu,906,,g æ j u,,,
25121,gurindji,906,,k a ɳ t i,,,
25124,guyani,906,,k a ɹ u,,,
25125,sydney,906,,w a dː e j,,,
25126,jaru,906,,g o l i b a w a ɹ a n,,,
25128,djiwarli,906,,w u ɹ u,,,
25131,kalkutung,906,,k u n k a,,,
25132,gamilaraay,906,,j u t i l,,,
25133,karadjeri,906,,p a k a,,,
25137,kartujarra,906,,w a ʈ a,,,
25140,kaurna,906,,a ɹ a,,,
25144,kukatja,906,,w a ʈ a,,,
25145,kukuyalanji,906,,c u k u,,,
25149,gurdjar,906,,k aː m ɣ i l k,,,
25150,kuukuyau,906,,j u k u,,,
25152,kalalagawya,906,,z u ŋ a,,,
25158,margany,906,,b a g a,,,
25159,martuwangka,906,,w a ʈ a,,,
25175,mudburra,906,,b u ɳ u,,,
25177,muruwari,906,,w i l p a n c,,,
25180,ngaanyatjarra,906,,ŋ a ɳ a,,,
25181,ngaanyatjarra,906,,p u ɳ u,,,
25182,ngaanyatjarra,906,,w a ʈ a,,,
25184,lowerriverland,906,,p e r o,,,
25185,lowerriverland,906,,p e r u,,,
25186,ngamini,906,,p iː t a,,,
25189,ngarinman,906,,g a ɳ d i,,,
25191,ngarluma,906,,w a ɳ d a,,,
25192,narrinyeri,906,,k o l g a,,,
25200,northerncoastalnyangumarta,906,,m u ŋ k a,,,
25201,nyamal,906,,w a ɳ t a,,,
25202,nyangumarta,906,,m u ŋ k a,,,
25203,nyunga,906,,b u ɳ,,,
25204,paakantyi,906,,j a ɹ a,,,
25207,panytyima,906,,k a ɳ t i n m a r a,,,
25208,banggarla,906,,w a d l a,,,
25209,bayungu,906,,c u ɭ a,,,
25215,pitjantjatjara,906,,p u n u,,,
25216,pittapitta,906,,m u l k a,,,
25218,ritarungo,906,,b o l o l o,,,
25219,dhalandji,906,,c u ɭ a,,,
25220,dhargari,906,,w i ɭ i,,,
25223,wagaya,906,,u ɹ iː r,,,
25229,ngura,906,,m a k u r a,,,
25233,warlpiri,906,,w a t i j a,,,
25235,wanman,906,,m a ɭ a l p a ɹ a,,,
25236,wariyangga,906,,w u ɹ u,,,
25237,warumungu,906,,j u w a l a,,,
25238,warumungu,906,,w i ɳ t i r i,,,
25240,wathawurrung,906,,k u r,,,
25245,wikmungkan,906,,k u c a n t a ŋ,,,
25246,wiradhuri,906,,m a d̪ a n,,,
25247,wirangunauo,906,,w a ɖ a,,,
25253,yannhangu,906,,ɖ a m b a ŋ a n i,,,
25254,yandruwandha,906,,w a t̪ i,,,
25257,yawarawarga,906,,k a k u ɹ a,,,
25259,yindjibarndi,906,,w a ɳ d a,,,
25262,yortayorta,906,,b i t c a,,,
25264,yulparitja,906,,k a n t i w a ŋ u,,,
25265,yuwaalaraay,906,,m u j aː n,,,
25266,adnyamathanha,857,,a d j ɲ a,,,
25268,alyawarr,857,,a p u ʈ,,,
25270,arabana,857,,k a d n̪ a,,,
25274,yugambehbandjalang,857,,t̪ a ɹ o,,,
25284,dhangu,857,,b a ɳ ɖ a,,,
25286,sydney,857,,k e p a,,,
10662,wirangunauo,1441,,j oː m b e ɹ a,,,
25290,dhuwal,857,,g u ɳ ɖ a,,,
25292,dieri,857,,m a ɖ a,,,
25293,dyaabugay,857,,w a l b a,,,
25294,djambarrpuyngu,857,,g u ɳ ɖ a,,,
25296,djinang,857,,b a ʈ i,,,
25301,gamilaraay,857,,m aː ɹ a m a,,,
25302,gamilaraay,857,,j a r a l,,,
25303,gamilaraay,857,,m aː j a m a,,,
25309,kumbainggar,857,,m u n iː m,,,
25313,gupapuyngu,857,,w a ʈ a p a,,,
25314,gurindji,857,,w u m a ɹ a,,,
25317,guyani,857,,k a n c a ŋ a m p a,,,
25318,sydney,857,,g i bː e ɹ,,,
25319,jaru,857,,b i l i a m b i,,,
25321,djiwarli,857,,p a ɭ u,,,
25324,kalkutung,857,,ɳ ʈ i a,,,
25325,gamilaraay,857,,j a r a l,,,
25326,karadjeri,857,,k a r a,,,
25330,kartujarra,857,,m a p a ɳ,,,
25333,kaurna,857,,p u ɹ e,,,
25337,kukatja,857,,p a ɹ m a r,,,
25338,kukuyalanji,857,,c a ŋ k a,,,
25346,gurdjar,857,,r eː m p,,,
25347,kuukuyau,857,,p aː ʔ a k u,,,
25349,kalalagawya,857,,k u l a,,,
25355,margany,857,,b a r i,,,
25356,martuwangka,857,,l i m p i l i m p i,,,
25374,mudburra,857,,p u j u k a,,,
25376,muruwari,857,,p a k u l,,,
25379,ngaanyatjarra,857,,p u ɭ i,,,
25380,ngaanyatjarra,857,,j a p u,,,
25383,lowerriverland,857,,p a ɭ k o,,,
25384,lowerriverland,857,,p a ɭ o,,,
25385,ngamini,857,,m a ɖ a,,,
25388,ngarinman,857,,w u m a r a,,,
25390,ngarluma,857,,m a ɳ d a,,,
25391,narrinyeri,857,,m a ʈ e,,,
25399,northerncoastalnyangumarta,857,,w a ɳ k u,,,
25400,nyamal,857,,m a ɳ t a,,,
25401,nyangumarta,857,,w a ɳ k u,,,
25402,nyunga,857,,b oː j a,,,
25403,paakantyi,857,,g a ɳ u,,,
25406,panytyima,857,,m a ɳ d a,,,
25407,banggarla,857,,k a ɲ a,,,
25408,bayungu,857,,k u c a,,,
25413,pitjantjatjara,857,,p u l i,,,
25414,pitjantjatjara,857,,a p u,,,
25415,pittapitta,857,,m i r h i w i ɳ i,,,
25417,ritarungo,857,,ɳ uː k a ʔ,,,
25419,dhalandji,857,,k u c a,,,
25420,dhargari,857,,p a ɖ u,,,
25423,wagaya,857,,p u ɳ ŋ u,,,
25430,ngura,857,,j a l d ɹ a,,,
25434,warlpiri,857,,p i ɭ i,,,
25436,wanman,857,,p u ɭ i,,,
25437,wariyangga,857,,p a ɭ u,,,
25438,warumungu,857,,w a ŋ a r i,,,
25440,wathawurrung,857,,l aː,,,
25444,wikmungkan,857,,i t̪,,,
25445,wiradhuri,857,,w a l a ŋ,,,
25446,wirangunauo,857,,p oː n d a,,,
25450,yannhangu,857,,d̪ u ŋ u p a l,,,
25451,yandruwandha,857,,m a ɖ ɹ a,,,
25452,yandruwandha,857,,m a ɖ ɹ a m i t c i,,,
25453,yandruwandha,857,,m a ɖ ɹ a t̪ a n d ɹ a,,,
25456,yawarawarga,857,,m a d ɹ a w a t i,,,
