ID,Language_ID,Parameter_ID,Form,Segments,Comment,Source,form_in_source
7618,djiwarli,2,,k u ɭ b a ɹ u,,,
7619,kalkutung,2,,k a t̪ u n k a r a,,,
7620,gamilaraay,2,,j u,,,
7621,karadjeri,2,,k u ɳ t u r,,,
7623,kartujarra,2,,p a ɳ a,,,
7624,kaurna,2,,w i r a i c a,,,
7626,kukatja,2,,t c u ʈ u ɭ,,,
7627,kukuyalanji,2,,b u l b u ɹ,,,
7630,gurdjar,2,,ɖ o m o t̪,,,
7631,gurdjar,2,,ɖ i m o e t̪,,,
7632,kuukuyau,2,,p a ʔ u,,,
7633,kalalagawya,2,,p u ɹ u,,,
7638,margany,2,,b u l g u ɹ a,,,
7639,martuwangka,2,,p a ɳ a,,,
7646,mudburra,2,,b u n k u,,,
7648,muruwari,2,,t̪ u ɭ t u,,,
7650,ngaanyatjarra,2,,j u l p u r u,,,
7652,lowerriverland,2,,ŋ u d l u n,,,
7653,ngamini,2,,k u n a p u t a ɹ a,,,
7654,ngarinman,2,,b u n g u,,,
7656,ngarluma,2,,g u ɳ d u r,,,
34044,yugambehbandjalang,1371,,g i n d i l,,,
7665,northerncoastalnyangumarta,2,,c u l p a r a c u l p a r a,,,
7666,nyamal,2,,k u ɭ u ɭ u,,,
7667,nyangumarta,2,,k u ɭ u ɭ u,,,
7668,nyunga,2,,t a n b a,,,
7670,panytyima,2,,k u n t u r p a,,,
7671,banggarla,2,,p u l b a,,,
7672,bayungu,2,,w u ɖ u r a,,,
7676,pitjantjatjara,2,,u l p u ɹ u,,,
7677,pittapitta,2,,t̪ u r k a,,,
7678,ritarungo,2,,b u ɳ u l k,,,
7680,dhalandji,2,,k a n k u r u,,,
7681,dhargari,2,,k u ɭ b a ɹ u,,,
7684,wagaya,2,,c i l j i,,,
35172,dhalandji,1200,,j a g a n,,,
7693,warlpiri,2,,c u ɖ u,,,
7694,wanman,2,,k u ɭ u ɭ u,,,
7695,wariyangga,2,,k u ɭ b a ɹ u,,,
7696,warumungu,2,,n a r a,,,
7697,wathawurrung,2,,m a n u l,,,
7699,wikmungkan,2,,k u ɹ k,,,
7700,wiradhuri,2,,b uː n a n,,,
7701,wirangunauo,2,,b u l b a,,,
7703,yannhangu,2,,ɹ i t c i,,,
7704,yandruwandha,2,,k u n u p u t̪ a,,,
7706,yawarawarga,2,,p u d l a p u d l a ɹ i,,,
7708,yindjibarndi,2,,c u ɖ uː,,,
7710,yulparitja,2,,c u ʈ u ɭ p a,,,
7711,yuwaalaraay,2,,j uː,,,
7712,adnyamathanha,1247,,j u ɹ i,,,
7714,alyawarr,1247,,i j l p a,,,
7716,arabana,1247,,j a r i,,,
34054,dhangu,1371,,ɳ e p a ɭ,,,
7719,yugambehbandjalang,1247,,b i n u ŋ,,,
7728,dhangu,1247,,b u t̪ u ɹ u,,,
34056,sydney,1371,,b u n a ŋ,,,
7730,sydney,1247,,k oː ʔ ɹ eː,,,
7735,dhuwal,1247,,b u t̪ u ɹ u,,,
7737,dieri,1247,,t̪ a ɭ p a,,,
7738,dyaabugay,1247,,b i n a,,,
7739,djambarrpuyngu,1247,,m æ k i ɹ i,,,
7741,djinang,1247,,m i ɳ i ŋ g a r i,,,
7746,gamilaraay,1247,,u d a,,,
7752,kumbainggar,1247,,ŋ aː l g a n,,,
7757,gupapuyngu,1247,,b u t̪ u ɹ u,,,
7758,gurindji,1247,,l a ŋ a,,,
7761,guyani,1247,,c u ɹ i,,,
7762,sydney,1247,,g oː r i,,,
7763,jaru,1247,,m a ŋ a,,,
7765,djiwarli,1247,,k u ɭ g a,,,
7768,kalkutung,1247,,i n̪ t̪ a,,,
7769,gamilaraay,1247,,b i nː a,,,
7770,karadjeri,1247,,b i d c a ɹ a,,,
7774,kartujarra,1247,,k u ɹ a n,,,
34064,djambarrpuyngu,1371,,b u n ˀk u m u,,,
7782,kukatja,1247,,l a ŋ a,,,
7783,kukuyalanji,1247,,m i l k a,,,
7789,gurdjar,1247,,ɖ e ŋ k a r,,,
7790,gurdjar,1247,,n eː l β i ɖ,,,
7791,gurdjar,1247,,ŋ a ɹ β a ɖ,,,
7792,kuukuyau,1247,,j a m p a,,,
7794,kalalagawya,1247,,k u r s a i,,,
7801,margany,1247,,m a ŋ a,,,
7802,martuwangka,1247,,k u ɹ a n p a,,,
7819,mudburra,1247,,l a ŋ a,,,
7821,muruwari,1247,,p i n a,,,
7824,ngaanyatjarra,1247,,j a n p i ɹ i,,,
7826,lowerriverland,1247,,w oː d t̪ a,,,
7827,ngamini,1247,,t a l p a,,,
7830,ngarinman,1247,,l a ŋ a,,,
7832,ngarluma,1247,,g u ɭ g a,,,
7833,narrinyeri,1247,,p l o m b a ŋ,,,
7841,northerncoastalnyangumarta,1247,,k u ɭ k a,,,
7842,nyamal,1247,,w eː n i ŋ,,,
7843,nyangumarta,1247,,k u ɭ k a,,,
7844,nyunga,1247,,d w o ŋ a,,,
7845,paakantyi,1247,,j u ɹ i,,,
7848,panytyima,1247,,k u ɭ k a,,,
7849,banggarla,1247,,e u ɹ i,,,
7850,banggarla,1247,,u ɹ i,,,
7851,banggarla,1247,,j oː ɹ i,,,
7852,bayungu,1247,,k u l i j a,,,
7856,pitjantjatjara,1247,,p i n a,,,
7857,pitjantjatjara,1247,,a n p i ɹ i,,,
7858,pittapitta,1247,,ŋ a r a w a,,,
7860,ritarungo,1247,,b u t̪ u r u,,,
7862,dhalandji,1247,,k u l i j a,,,
7863,dhargari,1247,,k u ɖ g a,,,
7866,wagaya,1247,,p i n a l,,,
34080,gupapuyngu,1371,,b u n ʔ k u m u,,,
7875,ngura,1247,,ŋ a ɹ a m a n d a,,,
7879,warlpiri,1247,,l a ŋ a,,,
7881,wanman,1247,,k u ɭ k a,,,
7882,wariyangga,1247,,k u l i j a,,,
7883,warumungu,1247,,k u w a ʈ a,,,
7885,wathawurrung,1247,,w i r ŋ,,,
7889,wikmungkan,1247,,k o n,,,
7890,wiradhuri,1247,,uː d̪ a,,,
7891,wirangunauo,1247,,j u ɹ i,,,
7897,yannhangu,1247,,b u t̪ u ɹ u,,,
7898,yandruwandha,1247,,t̪ a l p a,,,
7900,yawarawarga,1247,,k u t c e ɹ a,,,
7902,yindjibarndi,1247,,g u ɹ g a,,,
34085,sydney,1371,,b a n a,,,
8041,banggarla,1228,,j u r a,,,
7906,yortayorta,1247,,m a r m u,,,
7908,yulparitja,1247,,p i n a,,,
7909,yuwaalaraay,1247,,b i nː a,,,
7910,adnyamathanha,1228,,j u r a,,,
7911,adnyamathanha,1228,,j a ʈ a,,,
7912,alyawarr,1228,,a h e ɳ,,,
7914,arabana,1228,,w a d l u,,,
7918,yugambehbandjalang,1228,,c u k u n,,,
7928,dhangu,1228,,m u n a t̪ a,,,
7930,sydney,1228,,d u bː a ɹ,,,
7934,dhuwal,1228,,m u n a t̪ a,,,
7936,dieri,1228,,m i t̪ a,,,
7937,dyaabugay,1228,,b u l ŋ a n,,,
7938,djambarrpuyngu,1228,,m u n a t̪ a,,,
34091,gamilaraay,1371,,d̪ i n b i r,,,
7940,djinang,1228,,g u r b i,,,
7946,gamilaraay,1228,,t o w o n,,,
7952,kumbainggar,1228,,w a c aː r,,,
7957,gupapuyngu,1228,,m u n a t̪ a,,,
7958,gurindji,1228,,j u l u,,,
7961,guyani,1228,,d a k a,,,
7962,sydney,1228,,b i m b l e,,,
7963,jaru,1228,,c a ɲ c a,,,
7965,djiwarli,1228,,j a l̪ a,,,
7967,kalkutung,1228,,m uː,,,
7968,gamilaraay,1228,,d̪ o a n,,,
7969,karadjeri,1228,,ŋ u r a,,,
7972,kartujarra,1228,,p a ɳ a,,,
7975,kaurna,1228,,j e ʈ a,,,
7980,kukatja,1228,,w a ɹ i w a ɹ i,,,
7981,kukuyalanji,1228,,b u b u,,,
7986,gurdjar,1228,,n o l o k,,,
7987,kuukuyau,1228,,a m p u l,,,
7989,kalalagawya,1228,,l a g a l,,,
7994,margany,1228,,j a m b a,,,
7995,martuwangka,1228,,p a ɳ a,,,
34101,kukatja,1371,,m u d i,,,
34102,kukuyalanji,1371,,b u ŋ k u,,,
8010,mudburra,1228,,j u l u,,,
8012,muruwari,1228,,m a j i,,,
8015,ngaanyatjarra,1228,,m a n t a,,,
8018,lowerriverland,1228,,p u l j u r u,,,
8019,ngamini,1228,,w a l c u,,,
8022,ngarinman,1228,,j a ɳ a,,,
8024,ngarluma,1228,,b a ɭ a,,,
8025,narrinyeri,1228,,r u w,,,
8033,northerncoastalnyangumarta,1228,,w a r a ɳ,,,
8034,nyamal,1228,,ŋ a ɲ c a,,,
34107,gurdjar,1371,,ŋ gʷ i j ə l,,,
8036,nyunga,1228,,p a ɳ a,,,
8037,paakantyi,1228,,n̪ a ʈ i,,,
8040,panytyima,1228,,ŋ a ɲ c a,,,
34108,kuukuyau,1371,,p u ŋ k u,,,
8042,bayungu,1228,,ŋ a r a ɹ i,,,
8048,pitjantjatjara,1228,,m a n t a,,,
8049,pittapitta,1228,,m a j i,,,
8052,ritarungo,1228,,g a b a ɳ,,,
8053,dhalandji,1228,,j a l̪ a,,,
8054,dhargari,1228,,j a c a,,,
8057,wagaya,1228,,m iː ŋ k u,,,
8063,ngura,1228,,d a k a,,,
43262,warlpiri,1453,,j u ɭ k u r p a r i ɳ i,,,
8068,warlpiri,1228,,w a l u ɳ a r i,,,
8070,wanman,1228,,ɭ a ŋ a,,,
8071,wariyangga,1228,,j a l̪ a,,,
8072,warumungu,1228,,n a r a,,,
8074,wathawurrung,1228,,j o r u w o k d c aː,,,
34114,margany,1371,,m u g u,,,
8078,wikmungkan,1228,,aː k c i l,,,
8079,wiradhuri,1228,,d̪ aː g uː n,,,
8080,wirangunauo,1228,,b u d u,,,
42823,wikmungkan,1261,,p a t̪ a ŋ,,,
34115,martuwangka,1371,,m u ʈ i,,,
8086,yannhangu,1228,,m u n a t̪ a,,,
8087,yandruwandha,1228,,p a l a,,,
8090,yawarawarga,1228,,p a d l a,,,
8092,yindjibarndi,1228,,t̪ u ŋ g a,,,
8096,yortayorta,1228,,w o k a,,,
8098,yulparitja,1228,,p a ɳ a,,,
8099,yuwaalaraay,1228,,d̪ a j m aː r,,,
8100,adnyamathanha,1336,,ŋ a ɭ k u,,,
8102,alyawarr,1336,,a ɭ kʷ e j e l,,,
8104,arabana,1336,,t̪ a ɳ i,,,
8108,yugambehbandjalang,1336,,t a lː a l a,,,
42824,wiradhuri,1261,,b a bː i ɹ b a m b a r a,,,
8118,dhangu,1336,,ɲ a ŋ ˀt̪ u n,,,
8124,dhuwal,1336,,ɭ u k a,,,
8126,dieri,1336,,t̪ a j i,,,
8127,dyaabugay,1336,,b u g a j,,,
8128,djambarrpuyngu,1336,,ɭ u k a,,,
8130,djinang,1336,,m i ɳ ɖ i r b i g i,,,
8136,gamilaraay,1336,,t a lː j,,,
8141,kumbainggar,1336,,b i j a m b a,,,
8145,gupapuyngu,1336,,ɲ a ɭ u m a,,,
8146,gurindji,1336,,c a ʈ k a r a ŋ a ɳ a n a,,,
8149,guyani,1336,,ŋ a l k u,,,
8150,sydney,1336,,p a tː a,,,
8151,jaru,1336,,ŋ a n a n,,,
8153,djiwarli,1336,,t̪ i g a ɹ u,,,
8156,kalkutung,1336,,a ɹ i,,,
8157,gamilaraay,1336,,d̪ a l e,,,
8158,karadjeri,1336,,ŋ a n c a,,,
34128,muruwari,1371,,d̪ i n k a l,,,
8162,kartujarra,1336,,ŋ a,,,
8165,kaurna,1336,,m a i e n d i,,,
8171,kukatja,1336,,ŋ a l a,,,
8172,kukuyalanji,1336,,n u k a l,,,
8178,gurdjar,1336,,i l k,,,
34131,ngaanyatjarra,1371,,m u ʈ i,,,
8180,kuukuyau,1336,,j a ŋ k u ɲ a,,,
8182,kalalagawya,1336,,a i p u ɹ u t a i,,,
8188,margany,1336,,d̪ a l a,,,
8189,martuwangka,1336,,c a c a,,,
1366,wathawurrung,1291,,w u l u ɳ,,,
8204,mudburra,1336,,ŋ a l u,,,
8206,muruwari,1336,,t̪ a,,,
8209,ngaanyatjarra,1336,,m u ŋ u l k u,,,
8210,ngaanyatjarra,1336,,ŋ a l k u,,,
8212,lowerriverland,1336,,ŋ u n t u n,,,
8213,ngamini,1336,,t a c i n a,,,
8215,ngarinman,1336,,c a ɖ g a r a ɲ a ɲ a,,,
8218,ngarluma,1336,,b a c a,,,
8219,narrinyeri,1336,,t a k,,,
8227,northerncoastalnyangumarta,1336,,ŋ a n i ɲ i,,,
8228,nyamal,1336,,p a c a,,,
8229,nyangumarta,1336,,ŋ a n a ɲ a,,,
8230,nyunga,1336,,ŋ a nː a,,,
8231,paakantyi,1336,,k a ɹ i,,,
34140,ngarluma,1371,,m a ɳ b u r,,,
8234,panytyima,1336,,m a ŋ u n p i l k u,,,
8235,banggarla,1336,,ŋ a l k u t u,,,
8236,bayungu,1336,,p a c a n m a j i,,,
1373,wirangunauo,1291,,j a g u l u,,,
8244,pitjantjatjara,1336,,ŋ a l k u n i,,,
8245,pittapitta,1336,,t̪ a c i,,,
8247,ritarungo,1336,,ɭ u k a,,,
8248,dhalandji,1336,,p a c a l g i n,,,
8249,dhargari,1336,,m a ɳ i ɹ u,,,
8252,wagaya,1336,,w e t̪ i,,,
8253,wagaya,1336,,m e ɳ t,,,
8259,ngura,1336,,t̪ a l t̪ a,,,
8264,warlpiri,1336,,ŋ a ɳ i,,,
8266,wanman,1336,,m a c u r i,,,
8267,wariyangga,1336,,m a ɳ i ɹ u,,,
8268,warumungu,1336,,c a cː a n,,,
8270,wathawurrung,1336,,k u d c a,,,
8274,wikmungkan,1336,,w a c a m p u ŋ a ŋ,,,
8275,wiradhuri,1336,,a tː o p oː d a lː j,,,
8276,wirangunauo,1336,,ŋ a l g u ɳ,,,
1380,yandruwandha,1291,,k u l d ɹ u,,,
8282,yannhangu,1336,,b e n,,,
8283,yandruwandha,1336,,t̪ a j i,,,
8286,yawarawarga,1336,,t a c i n d ɹ i,,,
8288,yindjibarndi,1336,,ŋ a r g u,,,
8292,yortayorta,1336,,d̪ a t c i,,,
34150,nyangumarta,1371,,m u ʈ i ŋ i,,,
8294,yulparitja,1336,,ŋ a l a,,,
8295,yuwaalaraay,1336,,d̪ a l i,,,
8296,adnyamathanha,744,,v i p i,,,
8298,alyawarr,744,,kʷ a ʈ,,,
8300,arabana,744,,p a p u,,,
8304,yugambehbandjalang,744,,m oː ŋ a ɹ a i m,,,
1384,yindjibarndi,1291,,g a ɭ i,,,
8313,dhangu,744,,b a m b u ɹ u ŋ b u ɹ u ŋ,,,
8315,sydney,744,,k u b ʔ b i n,,,
8320,dhuwal,744,,m a p u,,,
8322,dieri,744,,k a p i,,,
8323,dyaabugay,744,,d i ŋ a l,,,
8324,djambarrpuyngu,744,,m a p u,,,
8326,djinang,744,,g i j i,,,
1388,yulparitja,1291,,m a l a k u,,,
8331,gamilaraay,744,,k o w,,,
1389,yuwaalaraay,1291,,b a w a,,,
8337,kumbainggar,744,,m i ɹ u b a j,,,
8342,gupapuyngu,744,,m a p u,,,
8343,gurindji,744,,k a m p i c,,,
8346,guyani,744,,p i p i,,,
8347,sydney,744,,g a b a ŋ,,,
8348,jaru,744,,g a m b i ɲ,,,
8350,djiwarli,744,,c i l u ɹ u,,,
8353,kalkutung,744,,k u t̪ u,,,
8354,gamilaraay,744,,k o,,,
8355,karadjeri,744,,ɲ u m a,,,
8358,kartujarra,744,,c a n c i,,,
8361,kaurna,744,,m u k a,,,
8364,kukatja,744,,g a m b i n,,,
8365,kukuyalanji,744,,d i b u r,,,
8371,gurdjar,744,,w oː t̪,,,
8372,kuukuyau,744,,w u j m p a,,,
8374,kalalagawya,744,,k a k u ɹ u,,,
8380,margany,744,,g a b u ɲ,,,
8381,martuwangka,744,,c a ɲ c i,,,
15555,ngura,1654,,p i t̪ a p i t̪ a,,,
8398,mudburra,744,,k a m b i c,,,
8400,muruwari,744,,k a p u n c,,,
8403,ngaanyatjarra,744,,ŋ a m p u,,,
8405,lowerriverland,744,,t o l d l o m k o,,,
8406,ngamini,744,,p a m p u,,,
8409,ngarinman,744,,g a m b i c,,,
8411,ngarluma,744,,c i m b u,,,
8412,narrinyeri,744,,t o l d l o m k o,,,
8420,northerncoastalnyangumarta,744,,c i m p u,,,
8421,nyamal,744,,m i c a ɹ a,,,
8422,nyangumarta,744,,m i c a,,,
8423,nyunga,744,,n u ɹ a g a,,,
8424,paakantyi,744,,b a ɖ i,,,
8428,panytyima,744,,c i m b u,,,
8429,banggarla,744,,p e pː i,,,
8430,bayungu,744,,k a w u ŋ g a,,,
8434,pitjantjatjara,744,,ŋ a m p u,,,
8435,pittapitta,744,,c i k u l a,,,
8437,ritarungo,744,,m a p u ʔ,,,
8439,dhalandji,744,,c i m b u,,,
8440,dhargari,744,,c i l u ɹ u,,,
8443,wagaya,744,,w iː t p u,,,
8448,ngura,744,,k a p i ɲ a,,,
8453,warlpiri,744,,ŋ i p i ɹ i,,,
8455,wanman,744,,ŋ a m p u,,,
8456,wariyangga,744,,c i l u ɹ u,,,
8457,warumungu,744,,m u l a,,,
8459,wathawurrung,744,,t a j n,,,
8463,wikmungkan,744,,n̪ e p a n,,,
8464,wiradhuri,744,,g a b uː g a,,,
8465,wirangunauo,744,,ŋ u g u ɳ,,,
8470,yannhangu,744,,g æ k u,,,
8471,yandruwandha,744,,p a m p u,,,
8474,yawarawarga,744,,p a n p u,,,
8476,yindjibarndi,744,,m i c a ɹ a,,,
8479,yortayorta,744,,b u t c a ŋ a,,,
8481,yulparitja,744,,c a ɲ c i,,,
8482,yuwaalaraay,744,,g a u,,,
8483,adnyamathanha,1248,,w a c i w a c i,,,
8485,alyawarr,1248,,a nː g a,,,
8487,arabana,1248,,m i l k i,,,
8491,yugambehbandjalang,1248,,m e,,,
35199,yortayorta,1200,,w i ɲ a n b u n a j i ɹ,,,
8501,dhangu,1248,,m a ŋ u t c i,,,
8503,sydney,1248,,m i,,,
8508,dhuwal,1248,,m iː l,,,
8510,dieri,1248,,m i l k i,,,
8511,dyaabugay,1248,,c i l i,,,
8512,djambarrpuyngu,1248,,m iː l,,,
8514,djinang,1248,,m i l,,,
8519,gamilaraay,1248,,m i l,,,
8525,kumbainggar,1248,,m i l,,,
8530,gupapuyngu,1248,,m iː l,,,
8531,gurindji,1248,,m i l a,,,
8534,guyani,1248,,m i n a,,,
8535,sydney,1248,,m j,,,
8536,jaru,1248,,m i l w a,,,
8539,djiwarli,1248,,k u ɹ u,,,
8542,kalkutung,1248,,m i l̪ t̪ i,,,
8543,gamilaraay,1248,,m i lː,,,
8544,karadjeri,1248,,p a n i,,,
8548,kartujarra,1248,,k u ɹ u,,,
8551,kaurna,1248,,m eː,,,
8556,kukatja,1248,,g u ɹ u,,,
8557,kukuyalanji,1248,,m i j i l,,,
35201,yulparitja,1200,,j i n m i,,,
8563,gurdjar,1248,,iː l,,,
8564,kuukuyau,1248,,k u ʔ u n,,,
8566,kalalagawya,1248,,p u ɹ k a,,,
8572,margany,1248,,d̪ i l i,,,
8573,martuwangka,1248,,k u ɹ u,,,
14470,northerncoastalnyangumarta,1410,,m i ɹ a n u,,,
8590,mudburra,1248,,m i l a,,,
8592,muruwari,1248,,m i l,,,
8595,ngaanyatjarra,1248,,k u ɹ u,,,
8598,lowerriverland,1248,,k o ɭ l o,,,
8599,ngamini,1248,,m i ɹ k i,,,
8602,ngarinman,1248,,m i l a,,,
8604,ngarluma,1248,,t̪ u ɭ a,,,
8605,narrinyeri,1248,,t u mː a k i,,,
8613,northerncoastalnyangumarta,1248,,p a n i,,,
8614,nyamal,1248,,t oː l a,,,
8615,nyamal,1248,,b oː l a,,,
8616,nyangumarta,1248,,c i ʈ a m a r a,,,
8617,nyunga,1248,,m e a l,,,
8618,paakantyi,1248,,m e i g i,,,
8621,panytyima,1248,,t̪ u ɭ a,,,
8622,banggarla,1248,,m eː n a,,,
8623,bayungu,1248,,k u ɹ u,,,
8630,pitjantjatjara,1248,,k u ɹ u,,,
8631,pittapitta,1248,,m i j i,,,
8633,ritarungo,1248,,m a ŋ u c i,,,
8634,dhalandji,1248,,k u ɹ u,,,
8635,dhargari,1248,,k u ɹ u,,,
8638,wagaya,1248,,m i nː g u,,,
8645,ngura,1248,,p u l d ɹ u,,,
8650,warlpiri,1248,,m i l p a,,,
8652,wanman,1248,,p a n a j a,,,
8653,wariyangga,1248,,k u ɹ u,,,
8654,warumungu,1248,,m i j i l,,,
8656,wathawurrung,1248,,m i r,,,
8660,wikmungkan,1248,,m eː ʔ,,,
8661,wiradhuri,1248,,m i lː,,,
8662,wirangunauo,1248,,m e i l,,,
8668,yannhangu,1248,,m a ŋ u t c i,,,
8669,yandruwandha,1248,,m i c i,,,
8671,yawarawarga,1248,,m i t c i,,,
8673,yindjibarndi,1248,,t̪ u ɭ a,,,
8677,yortayorta,1248,,m a,,,
8679,yulparitja,1248,,k u ɹ u,,,
8680,yuwaalaraay,1248,,m i lː,,,
8877,adnyamathanha,1280,,w a ɖ ɳ i,,,
8879,alyawarr,1280,,a j t n e j e l,,,
8883,arabana,1280,,ŋ o p a n a ŋ a ɹ i t c i n t a,,,
42831,yandruwandha,1261,,p a ɳ d ɹ i,,,
8886,yugambehbandjalang,1280,,b a n a,,,
8887,yugambehbandjalang,1280,,b a ŋ a,,,
8888,yugambehbandjalang,1280,,b a r w a,,,
8897,dhangu,1280,,g a l k i,,,
8899,sydney,1280,,b oː l ʔ l oː l b a l a,,,
8904,dhuwal,1280,,g a l k i r i,,,
8906,dieri,1280,,p u r i,,,
8907,dyaabugay,1280,,j a n a j ʔ,,,
8908,djambarrpuyngu,1280,,g a l k i r i,,,
8910,djinang,1280,,g a l m i d c i,,,
8913,gamilaraay,1280,,b u n d aː g i,,,
8917,kumbainggar,1280,,b uː n m i,,,
8922,gupapuyngu,1280,,w i r d c a w i r d c a ʔʲ u n,,,
8923,gurindji,1280,,p a ʈ w a n i ɲ a n a,,,
8926,guyani,1280,,w o ɹ k a n i n i w o d n i n t a,,,
8927,sydney,1280,,j i ɹ i,,,
8928,jaru,1280,,d o g a ɹ a m a n a,,,
8930,djiwarli,1280,,w a ɳ i ŋ g u,,,
8932,kalkutung,1280,,ŋ u j i,,,
8933,gamilaraay,1280,,b u n d a ŋ a,,,
8934,karadjeri,1280,,b o ŋ g a n c a,,,
8938,kartujarra,1280,,p u ŋ k a,,,
8940,kaurna,1280,,k a kː a w o ɳ e n d i,,,
8944,kukatja,1280,,p a t a l j u t i k u,,,
8945,kukuyalanji,1280,,d a ɹ a j,,,
8949,gurdjar,1280,,w i l β a j,,,
8950,kuukuyau,1280,,p u ŋ k a n a,,,
8952,kalalagawya,1280,,u ɹ a t i,,,
8959,margany,1280,,d̪ a ŋ g i,,,
8960,martuwangka,1280,,c u l j u l j u j a n u,,,
14483,dhalandji,1410,,n̪ u g u ɹ a,,,
8976,mudburra,1280,,c a k,,,
8977,muruwari,1280,,w a r a,,,
8980,ngaanyatjarra,1280,,l a ɲ t c a r u k a t i k u,,,
8981,ngaanyatjarra,1280,,p aː l j u k a t i k u,,,
8982,ngaanyatjarra,1280,,p aː l j u t c a l k i l k u,,,
8983,ngaanyatjarra,1280,,p u n k a l k u,,,
8985,lowerriverland,1280,,ŋ i n k a ŋ g u n,,,
8986,ngamini,1280,,w o ɹ a n t c a n t a,,,
8988,ngarinman,1280,,w a n i ɲ a,,,
8990,ngarluma,1280,,b u ŋ g a,,,
8991,narrinyeri,1280,,p i ŋ k,,,
8999,northerncoastalnyangumarta,1280,,p u ŋ k i ɲ i,,,
9000,nyamal,1280,,w a ɳ i,,,
9001,nyangumarta,1280,,p u ŋ k a,,,
9002,nyunga,1280,,d̪ a b a t,,,
9003,paakantyi,1280,,j aː g a,,,
9005,panytyima,1280,,w a ɳ i k u,,,
9006,banggarla,1280,,w a kː a r i t i,,,
9007,bayungu,1280,,w a ɳ i m a,,,
9011,pitjantjatjara,1280,,p u n k a n i,,,
9012,pitjantjatjara,1280,,p a t a ŋ a ɹ a ɲ i,,,
9013,pittapitta,1280,,k u r h a,,,
9015,ritarungo,1280,,g a l k i,,,
9016,dhalandji,1280,,w a ɳ i l g i n,,,
9017,dhargari,1280,,w a ɳ i,,,
9021,wagaya,1280,,i n p,,,
9032,ngura,1280,,p u l i,,,
9037,warlpiri,1280,,w a n t i m i,,,
9039,wanman,1280,,p u n k a l a,,,
9040,wariyangga,1280,,w a ɳ i ŋ g u,,,
9041,warumungu,1280,,w a n pː a n,,,
9043,wathawurrung,1280,,b a p w i r i,,,
9046,wikmungkan,1280,,e ɲ c,,,
9047,wiradhuri,1280,,b u n d i ŋ,,,
9048,wirangunauo,1280,,w aː ɳ,,,
9053,yannhangu,1280,,d̪ u l u l u ʔʲ u n,,,
9054,yandruwandha,1280,,k a ɹ i,,,
9055,yandruwandha,1280,,w a ɭ k a,,,
9056,yandruwandha,1280,,w a ɭ k a t̪ a r a,,,
9058,yawarawarga,1280,,p a n p a ŋ a ɹ i ɹ i,,,
9060,yindjibarndi,1280,,b u ŋ g a,,,
9061,yortayorta,1280,,d a t i,,,
9063,yulparitja,1280,,p u ŋ k a l a,,,
9064,yuwaalaraay,1280,,b u n d aː g i,,,
9065,adnyamathanha,1406,,i d n i,,,
9067,alyawarr,1406,,a ɭ e ŋ,,,
9069,arabana,1406,,p a ɹ a n t c a l̪ i,,,
9073,yugambehbandjalang,1406,,g a w u l j,,,
9074,yugambehbandjalang,1406,,b a g a ɹ g,,,
9075,yugambehbandjalang,1406,,w,,,
9076,yugambehbandjalang,1406,,g a j u h j n b a ɹ w,,,
9077,yugambehbandjalang,1406,,w i,,,
9084,dhangu,1406,,b æ r k u,,,
9085,sydney,1406,,ŋ g u ɹ ʔ ɹ a w a ŋ,,,
9088,dhuwal,1406,,b a r k u,,,
9090,dieri,1406,,w a d i t̪ a,,,
9091,dyaabugay,1406,,g a g a j,,,
9092,djambarrpuyngu,1406,,b a r k u,,,
9094,djinang,1406,,w a l a ŋ g a r a,,,
9096,gamilaraay,1406,,b i ɹ uː,,,
9099,kumbainggar,1406,,m a r iː ɹ,,,
9103,gupapuyngu,1406,,b a r k u,,,
9104,gurindji,1406,,j i k i l i,,,
9106,jaru,1406,,m a ɖ i j a w u,,,
9108,djiwarli,1406,,t̪ u ɭ i,,,
9111,kalkutung,1406,,j a r k a,,,
9112,gamilaraay,1406,,b i r u,,,
9113,karadjeri,1406,,k a c a ɹ i,,,
9116,kartujarra,1406,,t iː w a,,,
9117,kaurna,1406,,n u ɳ t i a n d a,,,
9119,kukatja,1406,,m a ɹ u n p u ɹ u,,,
9120,kukuyalanji,1406,,k a l a k a l b a j,,,
9123,gurdjar,1406,,r u aː j,,,
9124,kuukuyau,1406,,k a c i,,,
9127,kalalagawya,1406,,p o i t a i,,,
9133,margany,1406,,g a m b a r i,,,
9134,martuwangka,1406,,t i w a,,,
9140,mudburra,1406,,j iː k a j iː k a,,,
9142,muruwari,1406,,g u a ɹ e,,,
9144,ngaanyatjarra,1406,,t i w a,,,
9146,ngamini,1406,,w a ɹ a d a,,,
9148,ngarinman,1406,,j i n b u r u,,,
9150,ngarluma,1406,,w a r b a,,,
9151,narrinyeri,1406,,k u u n,,,
9156,northerncoastalnyangumarta,1406,,w u m a j i,,,
9157,nyamal,1406,,j a r k a,,,
9158,nyangumarta,1406,,k a c a,,,
9159,nyunga,1406,,k u d c a,,,
9160,nyunga,1406,,b oː j,,,
9161,paakantyi,1406,,b a ɹ i d c i ɹ i,,,
9164,panytyima,1406,,w a r p a,,,
9165,banggarla,1406,,n u r e ɹ i,,,
9166,bayungu,1406,,k a j i r i,,,
9171,pitjantjatjara,1406,,p a t u,,,
9172,pittapitta,1406,,w a r h a ɹ a,,,
9174,ritarungo,1406,,b a r k u,,,
9175,dhalandji,1406,,k a t̪ a ɹ a,,,
9176,dhargari,1406,,t̪ u ɭ i,,,
9179,wagaya,1406,,m i ŋ k i t̪ e ɭ,,,
9184,ngura,1406,,k a m p a,,,
9188,warlpiri,1406,,w u ɳ t u r u,,,
9189,wanman,1406,,w i r i l i,,,
9190,wariyangga,1406,,k a t̪ a ɹ a,,,
9191,warumungu,1406,,w a tː i,,,
9194,wikmungkan,1406,,k a c,,,
9195,wiradhuri,1406,,b i r a ŋ,,,
9196,wirangunauo,1406,,j a m b a,,,
9201,yannhangu,1406,,d̪ a w a l,,,
9202,yandruwandha,1406,,j u n d ɹ a,,,
9205,yindjibarndi,1406,,w a r w a,,,
9206,yortayorta,1406,,b u r a j a,,,
9208,yulparitja,1406,,p i n a,,,
9209,yuwaalaraay,1406,,b i u,,,
9210,adnyamathanha,323,,m a ɳ ɳ i t̪ a t a,,,
9212,alyawarr,323,,a w e k,,,
9213,alyawarr,323,,a n t e ɹ a nː g e r,,,
9214,alyawarr,323,,a n t e ɹ a k ŋ e r,,,
9216,arabana,323,,m a ɳ i,,,
9220,yugambehbandjalang,323,,b u n ɹ a ɹ a g u n,,,
9229,dhangu,323,,d c u k u r,,,
9231,sydney,323,,k oː ɹ ʔ ɹ a j,,,
9236,dhuwal,323,,d c u k u r,,,
9238,dieri,323,,m a ɳ i,,,
9239,dyaabugay,323,,g i l m b a r,,,
9240,djambarrpuyngu,323,,d c u k u r,,,
9242,djinang,323,,g u ɭ t c i,,,
9247,gamilaraay,323,,w a mː oː,,,
9253,kumbainggar,323,,m a r u m,,,
9257,gupapuyngu,323,,d c u k u r,,,
9258,gurindji,323,,w a ɹ a r,,,
9261,guyani,323,,m a n i,,,
9262,sydney,323,,g a ɹ u m a,,,
9263,jaru,323,,m o l g o,,,
9265,djiwarli,323,,c i n c i,,,
9268,kalkutung,323,,k u n̪ t̪ a l i,,,
9269,gamilaraay,323,,w a mː u,,,
9270,karadjeri,323,,l a j a,,,
9274,kartujarra,323,,c i n c i,,,
9277,kaurna,323,,k u ɹ k u ɭ a,,,
9281,kukatja,323,,m u t u r k a,,,
9282,kukuyalanji,323,,w a n d u l,,,
9288,gurdjar,323,,d̪ aː m p,,,
9289,gurdjar,323,,j aː m p i ɖ,,,
9290,kuukuyau,323,,k u ʔ i,,,
9292,kalalagawya,323,,ŋ a b i,,,
9298,margany,323,,d̪ a m i,,,
9299,martuwangka,323,,c i ɲ c i m a m a,,,
9315,mudburra,323,,d i k a,,,
9317,muruwari,323,,t̪ a n t i,,,
9320,ngaanyatjarra,323,,k a ɳ p i,,,
9323,lowerriverland,323,,m u d l a,,,
9324,ngamini,323,,m a ɳ i,,,
9327,ngarinman,323,,w a r a r,,,
9330,ngarluma,323,,c i n c i,,,
9331,narrinyeri,323,,ŋ a l t a u a c e,,,
9339,northerncoastalnyangumarta,323,,p a c a l i,,,
9340,nyamal,323,,w o ɳ d o,,,
9341,nyangumarta,323,,c i n c i,,,
9342,nyunga,323,,b w a ɳ,,,
9343,paakantyi,323,,m u ɳ i,,,
9345,panytyima,323,,c i ɲ c i,,,
9346,banggarla,323,,m u nː i,,,
9347,bayungu,323,,n̪ u l g a n,,,
9355,pitjantjatjara,323,,ŋ a t i n,,,
9356,pittapitta,323,,t̪ u t a,,,
9358,ritarungo,323,,d c u k u r,,,
9359,dhalandji,323,,n̪ u l g a n,,,
9360,dhargari,323,,n̪ a w a,,,
9363,wagaya,323,,m a n u,,,
9364,wagaya,323,,k u ŋ u,,,
14465,ngarinman,1410,,ŋ a r g a,,,
9371,ngura,323,,m a ɳ ŋ i,,,
9377,warlpiri,323,,c a ɹ a,,,
9379,wanman,323,,c i ɲ c i,,,
9380,wariyangga,323,,c i n c i,,,
9381,warumungu,323,,t iː k a,,,
9383,wathawurrung,323,,m a m b u l a,,,
9387,wikmungkan,323,,t̪ a n t̪,,,
9388,wiradhuri,323,,g uː r aː j,,,
9389,wirangunauo,323,,m i ɳ u,,,
9396,yannhangu,323,,g a n d a r j i n d i,,,
9397,yandruwandha,323,,m a ɳ i,,,
9398,yandruwandha,323,,m a ɳ i p i k a,,,
9401,yawarawarga,323,,w a ʈ c i,,,
9403,yindjibarndi,323,,g u ɹ uː ɹ u,,,
9407,yortayorta,323,,w a l i t c a,,,
9409,yulparitja,323,,c i ɹ a,,,
9410,yuwaalaraay,323,,w a m u,,,
9411,adnyamathanha,1217,,v a p i,,,
9413,alyawarr,1217,,a k ŋ e j,,,
9414,alyawarr,1217,,a j n i kʷ,,,
14498,warlpiri,1410,,m i l j a,,,
9416,arabana,1217,,a p i t c i,,,
9420,yugambehbandjalang,1217,,m a ɹ m o ŋ,,,
9430,dhangu,1217,,d c a w u ɭ p a,,,
9431,sydney,1217,,b e a n d a,,,
9436,dhuwal,1217,,d c a w u ɭ p a,,,
9438,dieri,1217,,ŋ a p i ɹ i,,,
9439,dyaabugay,1217,,ɲ u m b u,,,
9440,djambarrpuyngu,1217,,b æ p a,,,
9442,djinang,1217,,d c i r p i ŋ,,,
42213,adnyamathanha,1435,,j u ɖ ɭ i,,,
42214,alyawarr,1435,,p e r p e l e j e l,,,
42215,arabana,1435,,c a k a n t a,,,
9448,gamilaraay,1217,,b aː j n a,,,
42217,yugambehbandjalang,1435,,w,,,
42218,yugambehbandjalang,1435,,c,,,
9456,kumbainggar,1217,,b aː b a,,,
42225,dhuwal,1435,,ŋ u p a n,,,
42226,dieri,1435,,k a ɹ i,,,
42227,dyaabugay,1435,,d u b a j,,,
42228,djambarrpuyngu,1435,,ŋ u p a n,,,
9461,gurindji,1217,,b l i t̪,,,
42230,djinang,1435,,g u r p i g i,,,
9464,guyani,1217,,p a p i,,,
9465,sydney,1217,,b e a ŋ a,,,
9466,jaru,1217,,ŋ aː b i,,,
42236,gupapuyngu,1435,,ŋ a ŋ ʔ ŋ a ŋ d̪ u n,,,
42237,gurindji,1435,,k a j i p a n a n a,,,
9471,kalkutung,1217,,k u ɭ a,,,
9472,gamilaraay,1217,,b a i n a,,,
42241,djiwarli,1435,,j a ŋ a ɹ u,,,
42242,karadjeri,1435,,c i n a n p a,,,
42244,kaurna,1435,,j a kː a n d i,,,
9477,kartujarra,1217,,m a m a,,,
42246,kukatja,1435,,ŋ u l a l a,,,
42247,gurdjar,1435,,ŋ k o l a ŋ k,,,
42248,kuukuyau,1435,,w a l p a t̪ i n a,,,
42250,kalalagawya,1435,,w a k a i,,,
42252,margany,1435,,d̪ i d b a,,,
42254,mudburra,1435,,k i ɖ i k i ɖ i,,,
9487,kukuyalanji,1217,,ŋ a n c a n,,,
